Numero_Candidato,Nome_Completo,Votos,Situacao
70555,ELAINE CRISTINA DOS SANTOS ASSUNÇÃO,20,SUPLENTE
13245,ELAINE BARBOSA,23,NÃO ELEITO
19014,ELAILSON BENICIO MORAES,6,NÃO ELEITO
19123,ELADIR SARMENTO PINTO,1,SUPLENTE
15112,ELADIO SOUZA DA SILVA,39,SUPLENTE
65228,ELADIO NASCIMENTO DA SILVA,13,SUPLENTE
15100,ELADIO LUZ DE SOUSA FILHO,92,SUPLENTE
70456,ELADIO FARIAS DE OLIVEIRA,667,ELEITO POR MÉDIA
13123,EITOR ZANELATO,417,ELEITO POR QP
55100,EILA DE JESUS GIMAQUE FARIAS,49,SUPLENTE
20456,EIDE FERREIRA PINTO,112,SUPLENTE
22789,EGÍDIO MONTEIRO SOARES,97,NÃO ELEITO
15111,EGINALDO ROCHA SARGES,190,SUPLENTE
15111,EGILENE MARIA DA COSTA SILVA,133,SUPLENTE
17223,EGILDO FRANCISCO DA SILVA,91,SUPLENTE
25,EGILASIO ALVES FEITOSA,3507,ELEITO
22456,EGIESIO DOS SANTOS MARTINS,404,SUPLENTE
33888,EGIDIO GOMES BORGES,43,SUPLENTE
55333,EFRAIN SILVA DOS SANTOS,91,SUPLENTE
40105,EFRAIN RUBNICK DOS SANTOS RODRIGUES,8,NÃO ELEITO
20222,EFRAIN NONATO SILVA DE SOUSA,453,SUPLENTE
77100,EFRAIN KESLEI SOUZA ROCHA,25,SUPLENTE
15888,EFRAIM LISBOA DA COSTA,66,SUPLENTE
13222,EFIGENIA DE OLIVEIRA SILVA,415,ELEITO POR QP
55000,EFERYS SILVA SOUSA,30,SUPLENTE
70777,EDÉSIO MALENO DE OLIVEIRA MAIA,138,SUPLENTE
20123,EDYBRANDON LEAL DA SILVA,527,ELEITO POR MÉDIA
43133,EDWIN DE JESUS SILVA DOS SANTOS,84,SUPLENTE
17000,EDVARDO LEMES DA SILVA,98,SUPLENTE
90777,EDVARD DA SILVA GOMES JUNIOR,408,SUPLENTE
65222,EDVANDRO CARLOS MIRANDA DO VALE,34,SUPLENTE
65,EDVAN RODRIGUES DA SILVA,14,NÃO ELEITO
15678,EDVAN PEREIRA DA ABADIA,433,ELEITO POR QP
15321,EDVAN MENDES MEDEIROS,13,SUPLENTE
40625,EDVAN LINO RODRIGUES,254,SUPLENTE
19013,EDVAN COIMBRA RODRIGUES,67,NÃO ELEITO
22444,EDVAN BEZERRA DUARTE,187,SUPLENTE
14333,EDVAN ARAUJO SUASSANO,28,SUPLENTE
22789,EDVAN ANDRADE DE OLIVEIRA,0,NÃO ELEITO
45655,EDVAM FERREIRA NASCIMENTO,45,SUPLENTE
15222,EDVAM DUARTE DOS SANTOS,871,SUPLENTE
20000,EDVALDO SANTOS OLIVEIRA,411,SUPLENTE
20120,EDVALDO PEREIRA BATISTA,116,SUPLENTE
36225,EDVALDO NASCIMENTO DA SILVA,11,SUPLENTE
15444,EDVALDO MARIA DA SILVA,109,SUPLENTE
19000,EDVALDO JOSÉ BARBOSA GOMES,491,ELEITO POR QP
20222,EDVALDO GONÇALVES DE SOUSA,151,SUPLENTE
22200,EDVALDO GONCALVES DA SILVA,13,SUPLENTE
25222,EDVALDO DOS SANTOS AMARAL,34,SUPLENTE
28888,EDVALDO DIAS BATISTA,512,ELEITO POR MÉDIA
20123,EDVALDO DE VILHENA BECKMAN,462,SUPLENTE
90789,EDVALDO CANTUARIO CABRAL,3,SUPLENTE
14444,EDVALDO BRITO ROSA,359,ELEITO POR MÉDIA
12111,EDVALDO BENEDITO VALE DE SOUSA,16,SUPLENTE
15600,EDVALDO BARBOSA DOS SANTOS,71,SUPLENTE
77777,EDVALDA RUFINO DE FREITAS,245,SUPLENTE
15222,EDVALDA DOS REIS MARTINS,88,SUPLENTE
19123,EDUARDO WENDER DIAS,33,NÃO ELEITO
40222,EDUARDO VINICIUS DE JESUS SOUSA PIRES,78,SUPLENTE
20222,EDUARDO VIEIRA DOS SANTOS,39,SUPLENTE
10456,EDUARDO SILVA DO NASCIMENTO,124,SUPLENTE
15,EDUARDO SAMPAIO GOMES LEITE,16194,ELEITO
15111,EDUARDO SALOMAO DE SOUZA,230,SUPLENTE
13000,EDUARDO SALDANHA REIS,20,NÃO ELEITO
13456,EDUARDO RODRIGUES DA SILVA,374,ELEITO POR QP
19888,EDUARDO RIBEIRO DE AQUINO FILHO,100,SUPLENTE
50300,EDUARDO PROTÁZIO FILGUEIRAS,130,SUPLENTE
45717,EDUARDO PINHEIRO DA SILVA,81,SUPLENTE
20123,EDUARDO NAZARENO DE OLIVEIRA FEIO,101,NÃO ELEITO
15000,EDUARDO MIRANDA MORAES,30,SUPLENTE
43038,EDUARDO MARTINS CORDEIRO,11,SUPLENTE
22291,EDUARDO MAFRA RIBEIRO,146,NÃO ELEITO
70111,EDUARDO LUCENA XAVIER,99,NÃO ELEITO
10500,EDUARDO JUNIO BARBOSA DOURADO,70,SUPLENTE
70777,EDUARDO JOSE LACERDA DE MATOS,95,SUPLENTE
12777,EDUARDO JORGE PORTAL GONÇALVES,290,SUPLENTE
25800,EDUARDO ENRIQUE SOUSA FERNANDES,34,NÃO ELEITO
77231,EDUARDO DOS PASSOS NASCIMENTO,34,NÃO ELEITO
15215,EDUARDO DA SILVA FERREIRA,47,SUPLENTE
15345,EDUARDO CESAR GUERRA COSTA,414,SUPLENTE
14999,EDUARDO BRUNO GUIMARAES BARBOSA,34,SUPLENTE
51111,EDUARDO BENEDITO DOS SANTOS GOMES,30,NÃO ELEITO
11555,EDUARDO BARBOSA DE LIMA,87,SUPLENTE
19777,EDUARDO AUGUSTO BARROS KAHWAGE,215,SUPLENTE
90788,EDUARDO ARRAES DE SOUSA,725,SUPLENTE
90000,EDUARDO ALVES SENA,100,NÃO ELEITO
15,EDUARDO ALVES CONTI,7464,ELEITO
77003,EDUARDO ALESSANDRO DE ALMEIDA,5,SUPLENTE
33123,EDUARDA QUEIROZ PEREIRA,54,SUPLENTE
14666,EDUARDA FERREIRA PARENTE,88,SUPLENTE
22022,EDUARDA DE NAZARE PENA GRAIM,184,SUPLENTE
22222,EDSON VIEIRA FARIAS,441,ELEITO POR MÉDIA
65321,EDSON VANDER VIEIRA FARIAS,184,SUPLENTE
65111,EDSON SOUSA AMORIM,71,NÃO ELEITO
22110,EDSON SOARES BEZERRA,131,SUPLENTE
22444,EDSON SILVA MOTA,413,SUPLENTE
33500,EDSON SILVA DE PÁDUA,206,NÃO ELEITO
14333,EDSON SERRÃO MORAES,172,NÃO ELEITO
22777,EDSON SANTOS PEREIRA,112,SUPLENTE
20123,EDSON SANTOS FURTADO DA SILVA,645,ELEITO POR MÉDIA
35148,EDSON SANTANA,11,NÃO ELEITO
12012,EDSON SAMPAIO PEREIRA,215,SUPLENTE
15123,EDSON ROSEMILDO FREITAS,319,ELEITO POR QP
50047,EDSON ROCHA DE QUEIROZ,3,SUPLENTE
17777,EDSON RICARDO SILVA CARVALHO,66,NÃO ELEITO
77888,EDSON RIBEIRO DA SILVA,26,NÃO ELEITO
77130,EDSON RIBEIRO BARBOSA,65,NÃO ELEITO
36999,EDSON RAIMUNDO MACEDO DE CAMPOS,2,NÃO ELEITO
14000,EDSON PINHO BATISTA,398,NÃO ELEITO
22580,EDSON PINA DE CASTRO,64,SUPLENTE
15180,EDSON PEREIRA SANTOS,714,ELEITO POR MÉDIA
45555,EDSON PEREIRA DE SOUSA,357,SUPLENTE
23222,EDSON PEREIRA CAMPOS,340,SUPLENTE
27111,EDSON PAULO SIQUEIRA DOS SANTOS,159,SUPLENTE
43232,EDSON NUNES DE SOUSA,5,SUPLENTE
90100,EDSON NASCIMENTO DE LIMA,20,NÃO ELEITO
25127,EDSON MONTEIRO BARROS DA FONSECA,30,SUPLENTE
43999,EDSON MARQUES DA COSTA,21,SUPLENTE
10444,EDSON MAIA CORREA,101,SUPLENTE
28777,EDSON MACLAY MARREIROS,142,NÃO ELEITO
14444,EDSON LUIZ SILVEIRA ALVES,58,NÃO ELEITO
77192,EDSON LUIZ SILVA DOS SANTOS,27,NÃO ELEITO
14615,EDSON LUIS MACIEL DA SILVA,647,SUPLENTE
15333,EDSON LOPES DA SILVA,270,SUPLENTE
36555,EDSON LIMA MACHADO,29,NÃO ELEITO
33444,EDSON LIMA DE FREITAS,17,SUPLENTE
45123,EDSON JOSE FILHO,170,SUPLENTE
12789,EDSON JARTES PEREIRA,393,NÃO ELEITO
43777,EDSON GAIA DE SOUZA,14,NÃO ELEITO
11123,EDSON GABRIEL MOISES JUNIOR,0,NÃO ELEITO
17192,EDSON FERREIRA DE SOUZA,81,SUPLENTE
40,EDSON FERREIRA DA SILVA,989,NÃO ELEITO
45150,EDSON FERREIRA DA COSTA,9,SUPLENTE
15615,EDSON FERNANDO DA CUNHA,473,ELEITO POR QP
51555,EDSON DE SOUSA SILVA,62,SUPLENTE
15123,EDSON DE SOUSA FERREIRA,814,ELEITO POR MÉDIA
40101,EDSON DE PAULA SANTOS,30,SUPLENTE
19999,EDSON DE OLIVEIRA SOUSA,233,ELEITO POR MÉDIA
22111,EDSON DE OLIVEIRA COSTA,46,NÃO ELEITO
12777,EDSON DE JESUS MENDES MONTEIRO,98,SUPLENTE
15100,EDSON DE DEUS VEIRA,385,ELEITO POR MÉDIA
55007,EDSON DAMASCENO RODRIGUES,7,NÃO ELEITO
90200,EDSON DA SILVA ANDRADE,556,ELEITO POR MÉDIA
13777,EDSON DA SILVA,35,SUPLENTE
22325,EDSON COSTA DA SILVA,363,SUPLENTE
90678,EDSON CORREA DA SILVA,33,SUPLENTE
90190,EDSON CLAUDIO COSTA E SILVA JUNIOR,155,NÃO ELEITO
12333,EDSON CASTANHEIRA  DA SILVA,18,NÃO ELEITO
13131,EDSON CARLOTA MARIA,139,NÃO ELEITO
20015,EDSON CARLOS MONTEIRO DE ALMEIDA,2,SUPLENTE
11800,EDSON CARDOSO PINHEIRO,95,SUPLENTE
14000,EDSON CARDOSO DE ALMEIDA,36,NÃO ELEITO
15789,EDSON CAMPOS RESENDE,44,SUPLENTE
22001,EDSON CALHEIROS BATISTA,70,SUPLENTE
23111,EDSON BRANDAO BEZERRA,113,NÃO ELEITO
10789,EDSON BRAGA FARIAS,228,ELEITO POR MÉDIA
25555,EDSON BENTES NAIFF JUNIOR,553,ELEITO POR QP
10500,EDSON BARROSO DA SILVA,194,NÃO ELEITO
25255,EDSON BARBOSA RODRIGUES,35,SUPLENTE
90444,EDSON BARBOSA FURTADO,234,ELEITO POR MÉDIA
55678,EDSON BAHIA DOS SANTOS,51,NÃO ELEITO
90000,EDSON ATAIDE DE SOUSA,28,SUPLENTE
14555,EDSON ANDRE SALVIANO CAMPOS,829,ELEITO POR QP
27707,EDSON ANDRADE SOUZA,8,NÃO ELEITO
14710,EDSON AMARAL MARTINS,523,SUPLENTE
40121,EDSON ALVES RIBEIRO,5,SUPLENTE
51176,EDSON ALVES DE MELO,22,NÃO ELEITO
45451,EDSON AGOSTINHO ARAÚJO,35,SUPLENTE
15000,EDSON  GUERRA AZEVEDO COSTA,574,ELEITO POR MÉDIA
27223,EDREY TEIXEIRA VILHENA,301,SUPLENTE
15450,EDNO WILSON DE CASTRO ALMEIDA,5,SUPLENTE
45612,EDNO SANTANA DOS SANTOS,128,SUPLENTE
65456,EDNO JOSE MARQUES,4,NÃO ELEITO
14222,EDNO DOS SANTOS PORTO,134,NÃO ELEITO
15,EDNO ALVES DA SILVA,4839,NÃO ELEITO
15123,EDNILTON DA SILVA MEDEIROS,123,SUPLENTE
22222,EDNILSON ANTONIO FIGUEIREDO,428,ELEITO POR MÉDIA
43666,EDNILSE CAVALCANTI ALBUQUERQUE,140,SUPLENTE
15555,EDNEY MIRANDA CORREA,850,ELEITO POR QP
28100,EDNEY DE FARIAS ANDRADE,14,NÃO ELEITO
14777,EDNEY BARBOSA DA SILVA,42,SUPLENTE
15678,EDNEN RODRIGUES DE SOUZA,51,SUPLENTE
25655,EDNELSON DE OLIVEIRA SOARES,349,SUPLENTE
20456,EDNEI BARROS DA SILVA,20,SUPLENTE
25033,EDNEI ALMEIDA DA SILVA,156,SUPLENTE
20222,EDNAURA MORAIS DE CAMPOS,4,SUPLENTE
36912,EDNARA SOUSA DA SILVA,6,NÃO ELEITO
45000,EDNALVA GEREMIAS SILVA,250,SUPLENTE
22500,EDNALDO TEMBÉ,400,SUPLENTE
14888,EDNALDO TAVARES DE LIMA,47,SUPLENTE
65555,EDNALDO SOARES MOSCATELLI,53,NÃO ELEITO
36999,EDNALDO PEREIRA ZEFERINO,7,NÃO ELEITO
77444,EDNALDO PEREIRA DOS SANTOS,5,SUPLENTE
13333,EDNALDO NEVES DA SILVA,307,SUPLENTE
27777,EDNALDO MELO TEIXEIRA,243,SUPLENTE
10113,EDNALDO HOLDERLEY PEIXOTO,133,SUPLENTE
15165,EDNALDO DE ASSIS VIEIRA,151,SUPLENTE
14111,EDNALDO COSTA LOPES,140,SUPLENTE
12456,EDNALDO COSTA DE SOUSA,25,SUPLENTE
51,EDNALDO COLARES DA SILVA,2229,NÃO ELEITO
15456,EDNALDO ALEX PAIVA DE MENEZES,121,SUPLENTE
55123,EDNAL DA SILVA,8,NÃO ELEITO
13456,EDNA SILVA SANTOS,198,ELEITO POR QP
22365,EDNA PIMENTA DA COSTA,4,SUPLENTE
14012,EDNA MOREIRA DOS SANTOS,65,NÃO ELEITO
12333,EDNA MARIA SOUSA DOS SANTOS,237,SUPLENTE
13444,EDNA MARIA DOS SANTOS SOUZA,23,SUPLENTE
45123,EDNA MARIA CANUTO DE SÁ,193,SUPLENTE
77777,EDNA MARIA BEZERRA FERREIRA,1046,ELEITO POR QP
40444,EDNA MARIA ALMEIDA DOS SANTOS,80,SUPLENTE
22402,EDNA LUCIA FONSECA DE SENA,36,SUPLENTE
45432,EDNA JULIA RAMOS DOS SANTOS,83,SUPLENTE
65678,EDNA DOS SANTOS SOUZA,176,SUPLENTE
55888,EDNA DOS SANTOS PENA,21,SUPLENTE
70123,EDNA CRISTINA MARQUES CORREA,415,SUPLENTE
40444,EDNA CECÍLIA DE SOUZA,55,NÃO ELEITO
15158,EDNA BARBOSA DE ARAUJO,8,SUPLENTE
19147,EDNA BARATINHA DE OLIVEIRA,41,NÃO ELEITO
17686,EDNA AS NEVES ALVES,6,NÃO ELEITO
13000,EDMUNDO JUNIOR MARTINS LEAL,124,SUPLENTE
14444,EDMUNDO DOS SANTOS MOURA,521,SUPLENTE
13,EDMILZA MARQUES DA SILVA,307,NÃO ELEITO
90222,EDMILTON FREITAS ALVES,556,SUPLENTE
43510,EDMILTON ALVES DE FARIAS,17,NÃO ELEITO
12345,EDMILSON VERAS DA SILVA,127,SUPLENTE
22555,EDMILSON SILVA DOS SANTOS,15,NÃO ELEITO
12600,EDMILSON PEREIRA RODRIGUES,42,SUPLENTE
25251,EDMILSON NUNES CORREA LIMA NETO,7,SUPLENTE
11222,EDMILSON MOURA ALVES,137,SUPLENTE
51123,EDMILSON MARTINS FERREIRA,6,NÃO ELEITO
40024,EDMILSON GONCALVES BECHIR,421,NÃO ELEITO
22723,EDMILSON FERREIRA DA SILVA,372,ELEITO POR MÉDIA
20111,EDMILSON FARIAS COSTA,85,SUPLENTE
55655,EDMILSON DOS ANJOS MORAES,50,SUPLENTE
25555,EDMILSON DE SOUSA VIANA,299,SUPLENTE
12200,EDMILSON DE OLIVEIRA,121,NÃO ELEITO
10123,EDMILSON CAMPOS DOS SANTOS,296,SUPLENTE
50,EDMILSON BRITO RODRIGUES,33632,ELEITO
13111,EDMILSON BATISTA DE LIMA,16,NÃO ELEITO
23123,EDMILSON BARBOSA MONTEIRO,241,SUPLENTE
10500,EDMILSON BARBOSA CARDOSO,71,NÃO ELEITO
51555,EDMILSON ALVES DA COSTA,58,NÃO ELEITO
14556,EDMAX NUNES RODRIGUES,46,NÃO ELEITO
43175,EDMAR SALES DE SOUSA,40,NÃO ELEITO
70777,EDMAR PEREIRA RAMOS,650,ELEITO POR QP
45666,EDMAR PAULINO DE SOUZA,78,NÃO ELEITO
23200,EDMAR MARQUES DOS SANTOS,32,NÃO ELEITO
14777,EDMAR GOUVEA MOURA,25,NÃO ELEITO
18123,EDMAR DA SILVA CARVALHO,182,NÃO ELEITO
55111,EDLENA DO SOCORRO TELES DE FARIAS,127,SUPLENTE
15610,EDJANIO PRINTES FIGUEIRA,682,ELEITO POR QP
20120,EDJANE DA COSTA LINS,45,SUPLENTE
70201,EDJAILSON CORRÊA NOVAES,18,NÃO ELEITO
13456,EDIZANGELA ALVES BARROS,443,NÃO ELEITO
15555,EDIVANO JOÃO DE SOUSA,518,ELEITO POR QP
10713,EDIVANILDO CORREA CONCEIÇÃO,315,SUPLENTE
70123,EDIVANIA SOUSA VIEIRA,29,SUPLENTE
50122,EDIVANIA DE OLIVEIRA SANTOS,32,NÃO ELEITO
50555,EDIVANE SILVA LOBATO,39,SUPLENTE
45111,EDIVANE BORGES BATALHA,18,SUPLENTE
12101,EDIVANA DA COSTA PASTANA,16,SUPLENTE
22222,EDIVAN SOUSA VIEIRA,396,SUPLENTE
10156,EDIVAN RODRIGUES DOS SANTOS,4,NÃO ELEITO
23000,EDIVAN PINHEIRO DA SILVA,42,NÃO ELEITO
23333,EDIVAN PEREIRA DA COSTA,96,SUPLENTE
65777,EDIVAN NASCIMENTO MATIAS,98,SUPLENTE
45123,EDIVAN LUZ DA SILVA,35,SUPLENTE
77890,EDIVAN FRANCISCO GOMES,70,SUPLENTE
14789,EDIVAN DOS SANTOS OLIVEIRA,44,SUPLENTE
70422,EDIVAN DA SILVA LIRA,68,NÃO ELEITO
22222,EDIVAN DA COSTA GUIMARAES,264,SUPLENTE
45660,EDIVAN CARNEIRO DE SOUZA,139,SUPLENTE
15444,EDIVAN BARBOSA LEITE,63,SUPLENTE
10000,EDIVAN ANDRADE DA SILVA,102,SUPLENTE
22,EDIVAM SOUSA DAMASCENO,1006,NÃO ELEITO
20000,EDIVALDO XAVIER DE CARVALHO,195,SUPLENTE
19123,EDIVALDO VIEIRA RAMOS,621,ELEITO POR QP
55456,EDIVALDO VERCOSA DOS SANTOS,142,ELEITO POR QP
15000,EDIVALDO SOUSA PESSOA,70,SUPLENTE
22226,EDIVALDO SILVA SANTOS,32,SUPLENTE
13514,EDIVALDO SILVA CARVALHO,23,NÃO ELEITO
27027,EDIVALDO SANTOS PORTILHO,13,NÃO ELEITO
36190,EDIVALDO RODRIGUES CABRAL,116,NÃO ELEITO
17100,EDIVALDO RIBEIRO PENICHE,9,NÃO ELEITO
15131,EDIVALDO REPOLHO DE VASCONCELOS,181,SUPLENTE
55000,EDIVALDO RAMOS DA SILVA,34,SUPLENTE
45123,EDIVALDO PEREIRA SOARES JUNIOR,80,SUPLENTE
23456,EDIVALDO PEREIRA DA SILVA,177,NÃO ELEITO
51000,EDIVALDO MAX DA COSTA MATOS,14,NÃO ELEITO
45120,EDIVALDO JORGE CASTRO DE SOUSA,322,SUPLENTE
55155,EDIVALDO JANUÁRIO DOS SANTOS,231,NÃO ELEITO
70000,EDIVALDO GONÇALVES DE OLIVEIRA,802,SUPLENTE
25147,EDIVALDO DINIZ FERREIRA,51,SUPLENTE
35444,EDIVALDO DE SOUZA SILVA,7,NÃO ELEITO
22200,EDIVALDO DE SOUZA GUIMARÃES,84,SUPLENTE
19333,EDIVALDO DE MEDEIROS LEITE,64,SUPLENTE
14147,EDIVALDO DE LIMA MATOS,52,NÃO ELEITO
11333,EDIVALDO DE JESUS MENDES,50,NÃO ELEITO
10234,EDIVALDO DA SILVA SANTOS,197,SUPLENTE
55678,EDIVALDO DA SILVA MIRANDA,126,SUPLENTE
45555,EDIVALDO DA SILVA COSTA,23,NÃO ELEITO
10223,EDIVALDO DA CRUZ BRANDÃO,26,SUPLENTE
14234,EDIVALDO DA COSTA CRUZ,1,SUPLENTE
20321,EDIVALDO DA CONCEICAO,282,ELEITO POR MÉDIA
55444,EDIVALDO CUNHA GOMES,36,NÃO ELEITO
40123,EDIVALDO CARLOS PEREIRA,62,SUPLENTE
15345,EDIVALDO BORGES GOMES,545,ELEITO POR MÉDIA
70000,EDIVALDO BASTOS DOURADO JUNIOR,402,SUPLENTE
20555,EDIVALDA DE NAZARÉ SOUZA LOBATO,46,SUPLENTE
55333,EDIVAL DE OLIVEIRA ELERES,92,SUPLENTE
70555,EDIVAL ALVES DE OLIVEIRA,61,SUPLENTE
20020,EDITON DIVINO JUNIOR,95,SUPLENTE
45444,EDITH PEREIRA DE SOUSA,124,SUPLENTE
25625,EDITE FERREIRA DE AQUINO NETA,104,SUPLENTE
65123,EDISON SANTA BRÍGIDA MONTEIRO,11,NÃO ELEITO
14456,EDISON MIRANDA DA SILVEIRA,266,SUPLENTE
15000,EDISON DAMIÃO DE SOUSA,403,SUPLENTE
22555,EDISON DA SILVA AGUIAR,126,SUPLENTE
13333,EDISLEY GONÇALVES DE MACEDO,460,NÃO ELEITO
77091,EDIRENE DA SILVA MONTEIRO,67,NÃO ELEITO
15777,EDIR PINHEIRO CORREA,516,SUPLENTE
15015,EDIONY CORDOVIL FREIRE,2,SUPLENTE
90020,EDIONES DE MORAES SOUSA,182,SUPLENTE
45452,EDIONE MACIEL DE SOUZA,64,NÃO ELEITO
10101,EDIO FERREIRA SILVA,358,SUPLENTE
23192,EDINO DOS SANTOS PEREIRA,55,NÃO ELEITO
20,EDINO CARMO BATISTA GOMES,1368,NÃO ELEITO
12000,EDINO BARROSO SILVA,77,NÃO ELEITO
22145,EDINILZA ASSIS DA NATIVIDADE,142,SUPLENTE
77123,EDINILTON DOMINGOS ALMEIDA BRAGA,669,ELEITO POR QP
55666,EDINILSON DE OLIVEIRA CHAVES,379,SUPLENTE
28999,EDINILSON CARDOSO DE SOUZA,61,SUPLENTE
35217,EDINEY SILVA MARCELINO,0,NÃO ELEITO
11444,EDINEUZA CHAVES DA SILVA PENICHE,118,SUPLENTE
25025,EDINETH DOS SANTOS RODRIGUES,61,SUPLENTE
55333,EDINELSON DA ROCHA MENDES,38,SUPLENTE
22222,EDINELSON ALVES DA SILVA,628,ELEITO POR QP
11971,EDINELSA DOS SANTOS REIS,91,NÃO ELEITO
45010,EDINELMA DA SILVA ATAIDE,15,SUPLENTE
50121,EDINEL ASSUNÇÃO BASTOS,71,SUPLENTE
20888,EDINEIA REIS ALMEIDA,67,SUPLENTE
23445,EDINEIA GONÇALVES BARBOSA,86,SUPLENTE
45000,EDINEI PINHEIRO,141,SUPLENTE
22220,EDINEI DA SILVA,38,NÃO ELEITO
15123,EDINEI DA COSTA DEMES,269,SUPLENTE
35035,EDINALVA DO NASCIMENTO SOUSA,10,NÃO ELEITO
12777,EDINALVA DA SILVA NERY,26,NÃO ELEITO
22567,EDINALDO SOUZA DA ROCHA,103,SUPLENTE
77600,EDINALDO SOUSA SILVA,13,NÃO ELEITO
65678,EDINALDO SOUSA DA SILVA,3,SUPLENTE
25522,EDINALDO SILVA DOS SANTOS,205,SUPLENTE
22122,EDINALDO RODRIGUES DE SOUSA,185,SUPLENTE
10999,EDINALDO RIBEIRO DOS SANTOS,27,SUPLENTE
14555,EDINALDO PONTES RAMOS,142,SUPLENTE
10748,EDINALDO PANTOJA SOARES,51,SUPLENTE
15121,EDINALDO OLIVEIRA DA ROCHA,268,SUPLENTE
14000,EDINALDO OLIVEIRA CORREA,19,SUPLENTE
36111,EDINALDO MOREIRA NUNES,81,NÃO ELEITO
15222,EDINALDO MOREIRA ALVES,5,SUPLENTE
25051,EDINALDO MORAES DE SOUZA,129,SUPLENTE
25100,EDINALDO MARTINS DA SILVA,294,SUPLENTE
55151,EDINALDO LIMA DE BRITO,70,SUPLENTE
45000,EDINALDO GONSALVES PEREIRA,88,SUPLENTE
15456,EDINALDO GALENO DE SOUZA,20,SUPLENTE
14123,EDINALDO FIGUEIRO FONSECA,126,NÃO ELEITO
22121,EDINALDO FARIAS ALVES,55,NÃO ELEITO
33100,EDINALDO DOS SANTOS SILVA,22,SUPLENTE
20567,EDINALDO DOS SANTOS LIMA,132,SUPLENTE
45222,EDINALDO DE SOUSA CORREIA,30,NÃO ELEITO
10900,EDINALDO DE ARAUJO LIMA,67,SUPLENTE
13000,EDINALDO DA SILVA TEIXEIRA,73,SUPLENTE
65444,EDINALDO DA SILVA COSTA,3,NÃO ELEITO
12888,EDINALDO DA SILVA ASSUNÇÃO,50,NÃO ELEITO
15555,EDINALDO BONFIM DA SILVA,326,ELEITO POR MÉDIA
14444,EDINALDO BARROS SILVA,63,SUPLENTE
23818,EDINALDO ANTONIO ALVES RAMOS,2,SUPLENTE
15610,EDINALDO ALVES DE SOUZA,97,SUPLENTE
17777,EDINALDO ALEXANDRE ALVES FURTADO,2,NÃO ELEITO
15123,EDINALDO AFONSO DE OLIVEIRA,834,ELEITO POR QP
70258,EDINAIRA TRINDADE VULCÃO,84,SUPLENTE
55444,EDINAIR DOS SANTOS MONTEIRO,9,SUPLENTE
77133,EDINAELSON RIBEIRO DE SOUZA,29,NÃO ELEITO
45222,EDINA RIBEIRO ALVES,153,SUPLENTE
45456,EDINA NASCIMENTO DA COSTA,46,SUPLENTE
14233,EDINA MONTEIRO FERREIRA,38,NÃO ELEITO
90999,EDINA MARIA DOS SANTOS BARBOSA,32,NÃO ELEITO
40231,EDINA MARIA BARBOSA FERREIRA,104,SUPLENTE
13022,EDINA DOS SANTOS SILVA,102,NÃO ELEITO
15555,EDINA CARVALHO DE OLIVEIRA,39,SUPLENTE
10222,EDIMISON PANTOJA SANTOS,60,SUPLENTE
15000,EDIMISON JOSE DA SILVA LAMEIRA,93,SUPLENTE
55770,EDIMILTON DE FREITAS MEDEIROS,155,SUPLENTE
50554,EDIMILSON REIS DO ROSÁRIO,24,NÃO ELEITO
25678,EDIMILSON PINHEIRO MERELES,160,SUPLENTE
10223,EDIMILSON PEREIRA CAMPOS,245,SUPLENTE
55999,EDIMILSON FURTADO FERREIRA,32,SUPLENTE
13139,EDIMILSON FERREIRA NASCIMENTO,80,SUPLENTE
10111,EDIMILSON FERREIRA DOS SANTOS,163,NÃO ELEITO
10018,EDIMILSON DO ROSARIO QUEIROZ,43,SUPLENTE
19999,EDIMILSON DE SOUZA CRISTO,211,SUPLENTE
13555,EDIMILSON DE JESUS DA COSTA PENICHE,39,SUPLENTE
13111,EDIMILSON DA SILVA BAIA,9,NÃO ELEITO
45444,EDIMILSON DA CONCEICAO,12,NÃO ELEITO
22678,EDIMILSON COSTA SILVA,18,SUPLENTE
14555,EDIMILSON ALVES DO NASCIMENTO,197,SUPLENTE
15129,EDIMARCIA CAMPOS TAVARES,33,SUPLENTE
13051,EDIMARA VAREJÃO SOUTO,56,SUPLENTE
77007,EDIMAR VIEIRA DOS SANTOS,7,SUPLENTE
13456,EDIMAR SILVA BRASIL,191,NÃO ELEITO
20777,EDIMAR SANTANA DA SILVA,21,SUPLENTE
15333,EDIMAR PEREIRA DA SILVA,137,SUPLENTE
15190,EDIMAR NASCIMENTO DE SOUZA,122,SUPLENTE
12333,EDIMAR DA SILVA GUIMARÃES,50,SUPLENTE
10010,EDIMAR CAVALCANTE,246,SUPLENTE
40000,EDIMA TAVARES ASSUNCAO,21,SUPLENTE
77999,EDIM DIAS GASPAR,229,NÃO ELEITO
55222,EDILÉIA MARIA PIMENTEL RAMOS,150,SUPLENTE
11234,EDILZA DE JESUS MOREIRA PIMENTEL,398,SUPLENTE
13111,EDILVA SOARES DA SILVA,20,SUPLENTE
19,EDILSON VIEIRA RAMOS,5044,NÃO ELEITO
20000,EDILSON TEIXEIRA DOS SANTOS,464,ELEITO POR QP
77778,EDILSON SOUZA SILVA,120,SUPLENTE
14555,EDILSON SOUSA LIMA,256,SUPLENTE
18,EDILSON SILVA OLIVEIRA,53,NÃO ELEITO
22334,EDILSON SANTOS,39,SUPLENTE
14001,EDILSON RODRIGUES COSTA,154,SUPLENTE
51150,EDILSON ROBERTO RAMOS DE FARIAS,29,NÃO ELEITO
36800,EDILSON RAIMUNDO ALVES DA ROCHA,128,NÃO ELEITO
23177,EDILSON QUIRINO DA SILVA,33,SUPLENTE
11999,EDILSON PIEDADE DA CONCEIÇÃO,86,SUPLENTE
25011,EDILSON OLIVEIRA PIMENTEL,31,SUPLENTE
65001,EDILSON NASCIMENTO DA SILVA,77,SUPLENTE
13000,EDILSON MOREIRA DO NASCIMENTO,403,ELEITO POR MÉDIA
15100,EDILSON MOREIRA DA SILVA,216,SUPLENTE
10,EDILSON MARTINS PAES,3333,NÃO ELEITO
77477,EDILSON MAIA CORDOVIL,32,SUPLENTE
14333,EDILSON LOPES DE SOUSA,143,NÃO ELEITO
45,EDILSON LIRA PATROCINIO,159,NÃO ELEITO
33999,EDILSON HERCULANO DE MORAES,24,SUPLENTE
13132,EDILSON GOMES LIRA,39,NÃO ELEITO
65024,EDILSON FONSECA,38,NÃO ELEITO
10107,EDILSON DOS SANTOS ROBERTO,153,NÃO ELEITO
23100,EDILSON DOS SANTOS FERRAZ,39,NÃO ELEITO
27010,EDILSON DE OLIVEIRA EVANGELISTA,40,NÃO ELEITO
14014,EDILSON DE JESUS CORREIA,65,SUPLENTE
15888,EDILSON DA SILVA MACHADO,24,SUPLENTE
10007,EDILSON DA COSTA SOUZA,3,SUPLENTE
10999,EDILSON CARVALHO TEIXEIRA,7,NÃO ELEITO
23123,EDILSON CARNEIRO DE MELO,348,SUPLENTE
15234,EDILSON CARDOSO DA SILVA,71,SUPLENTE
15022,EDILSON CAMPOS COSTA,15,SUPLENTE
14000,EDILSON BULHÕES DE SOUSA,786,ELEITO POR MÉDIA
51035,EDILSON BRAGA MIRANDA,3,SUPLENTE
13122,EDILSON BEZERRA FERREIRA,32,SUPLENTE
13345,EDILSON BATISTA DE CARVALHO,49,SUPLENTE
19017,EDILSON BATISTA DA SILVA,18,SUPLENTE
14100,EDILSON BATISTA CARVALHO,43,SUPLENTE
10444,EDILSON BARBOSA DA SILVA,9,SUPLENTE
20444,EDILSON BARBOSA COUTINHO,144,SUPLENTE
55555,EDILSON ANDRADE MALAQUIAS,220,SUPLENTE
12123,EDILSON ALVES DE OLIVEIRA,314,NÃO ELEITO
45112,EDILSOM DA SILVA SANTOS,81,SUPLENTE
15123,EDILMA ROCHA GAIA  AYRES,4,NÃO ELEITO
51000,EDILMA RESPLANDES QUEIRÓS,3,NÃO ELEITO
35260,EDILMA DE AZEVEDO GALVÃO,2,NÃO ELEITO
22111,EDILEUZA VILELA MORAIS,212,SUPLENTE
13222,EDILEUZA VIEGAS MUNIZ,1656,ELEITO POR MÉDIA
13333,EDILEUZA VIANA,153,NÃO ELEITO
20123,EDILEUZA SOUSA MELO DOS SANTOS,99,NÃO ELEITO
19800,EDILEUZA AVOREDO PEREIRA,30,SUPLENTE
13013,EDILEUSA DIAS COSTA,113,SUPLENTE
70000,EDILEUSA DE SOUSA LIMA,71,SUPLENTE
22230,EDILEUSA DA SILVA SOUSA,0,SUPLENTE
20123,EDILEUDE BORGES FIGUEIRA GUEDES,11,SUPLENTE
28123,EDILENE SOUZA CANTÃO,36,NÃO ELEITO
10177,EDILENE SOUSA PESSOA,139,SUPLENTE
70101,EDILENE SANTOS FERNANDES,37,NÃO ELEITO
19300,EDILENE RODRIGUES MELO,26,SUPLENTE
20456,EDILENE PINHEIRO DA SILVA,8,SUPLENTE
65777,EDILENE PEREIRA NEVES MACIEL,154,SUPLENTE
51111,EDILENE NUNES SOUSA COSTA,62,NÃO ELEITO
23555,EDILENE MONTEIRO VIANA,15,NÃO ELEITO
50456,EDILENE MELO DE LUCENA,24,NÃO ELEITO
36123,EDILENE LIMA MIRANDA,0,NÃO ELEITO
45200,EDILENE FRANCISCA DE ARAUJO,85,SUPLENTE
45111,EDILENE DOS PASSOS PEIXOTO,5,SUPLENTE
22444,EDILENE DO SOCORRO GOMES DE SOUSA,188,NÃO ELEITO
19000,EDILENE DA SILVA PAIXÃO,317,SUPLENTE
20333,EDILENE CRYSTINA RODRIGUES COELHO,383,SUPLENTE
55222,EDILENE CARDOSO DOS REIS,14,NÃO ELEITO
55115,EDILENE CARDOSO DA COSTA,36,SUPLENTE
28885,EDILENE BRITO PINHEIRO,29,NÃO ELEITO
20115,EDILENE  CARVALHO LOPES,15,SUPLENTE
15272,EDILENA RODRIGUES DOS SANTOS,35,SUPLENTE
43192,EDILENA MANITO DIAS,13,SUPLENTE
15124,EDILENA AMARAL SARAIVA,186,SUPLENTE
22001,EDILEIZE LEÃO DE CASTRO,32,NÃO ELEITO
45999,EDILEIDE HELENA DE SOUZA,2,SUPLENTE
51551,EDILEIA SOARES LOPES DA SILVA,2,NÃO ELEITO
23003,EDILEIA MAMEDE LUCAS DE SOUZA,5,NÃO ELEITO
70910,EDILEIA DA SILVA PAES,560,NÃO ELEITO
20277,EDILEIA DA SILVA NEVES,449,SUPLENTE
15555,EDILEI MARIA LOPES DE SOUZA,324,SUPLENTE
22999,EDILCIVAM SILVA GASPAR,127,SUPLENTE
51111,EDILBERTO PUREZA VON PAUMGARTTEN,30,NÃO ELEITO
15620,EDILBERTO LEÃO MARQUES,419,SUPLENTE
20320,EDILBERTO GALVAO E SILVA,14,SUPLENTE
13388,EDILAMAR MACHADO DA COSTA,26,NÃO ELEITO
55111,EDIEVERSON DO CARMO BORGES DE CASTRO,74,NÃO ELEITO
70888,EDIENILDO XAVIER DE FRANCA,140,SUPLENTE
15789,EDIENE TABOSA DE BARROS,4,SUPLENTE
25255,EDIENE GOMES DO NASCIMENTO,28,SUPLENTE
15155,EDIELSON SANTIAGO MOURA,233,SUPLENTE
23111,EDIELSON RAFAEL FERREIRA SANTIAGO,12,NÃO ELEITO
22024,EDIELSON MATOS PINHEIRO,32,SUPLENTE
19555,EDIELSON FERREIRA BAGATA,157,SUPLENTE
45999,EDIELSON DA COSTA TAVARES,668,ELEITO POR QP
20456,EDIELSON CRUZ DIAS,87,SUPLENTE
25567,EDIELSON BARBOSA DE MORAES,154,SUPLENTE
51040,EDIELSON AMARAL SERRÃO,129,NÃO ELEITO
12444,EDIELMA TRINDADE BRANQUINHO,12,SUPLENTE
28123,EDICÉLIO DO CARMO ARAÚJO,10,NÃO ELEITO
19111,EDICLÉIA RODRIGUES DOS SANTOS,1,NÃO ELEITO
15666,EDICLEI DOS SANTOS MACHADO,102,SUPLENTE
28000,EDICIONE RODRIGUES DA CONCEIÇÃO SILVA,40,NÃO ELEITO
19000,EDICINAMAR DE NAZARE DA ROCHA E SILVA,240,NÃO ELEITO
25775,EDICIMAR SOURIENSE CORREA,2,SUPLENTE
45566,EDIAS MONTEIRO DA SILVA,69,SUPLENTE
28579,EDIANE TEIXEIRA FERREIRA,5,SUPLENTE
14580,EDIANA RIVIA SILVA NASCIMENTO,20,SUPLENTE
15015,EDIANA BRANDAO GAMA DE SOUZA,7,SUPLENTE
13113,EDI SANTOS DE SOUZA,4,SUPLENTE
40222,EDI DA SILVA TEIXEIRA,74,NÃO ELEITO
50444,EDGAR SOARES MARTINS,0,NÃO ELEITO
45130,EDGAR SILVA NETO,36,SUPLENTE
10190,EDGAR SILVA DO ROSARIO,151,NÃO ELEITO
23690,EDGAR RODRIGUES DE SOUZA JUNIOR,163,SUPLENTE
70007,EDGAR BARRETO BARBOSA,135,SUPLENTE
19,EDGAR AUGUSTO QUADROS,857,NÃO ELEITO
15555,EDGAR AUGUSTO MAIA COSTA,390,SUPLENTE
33444,EDEZIO MOREIRA DE SOUZA,414,ELEITO POR MÉDIA
15000,EDEVALDO TAVARES GONÇALVES,436,ELEITO POR MÉDIA
65130,EDEVAL PEREIRA BARRA,665,ELEITO POR QP
70123,EDERSON FELIX SERRA,274,SUPLENTE
45500,EDERLAN DOS SANTOS TAVARES,383,SUPLENTE
15151,EDERALDO DE SA SILVA,3,SUPLENTE
15333,EDER SERRÃO FRANÇA,111,SUPLENTE
15123,EDER RIBEIRO DA SILVA,1328,ELEITO POR QP
20112,EDER NILSON BARBOSA BENTES,25,SUPLENTE
20789,EDER MORAES DE JESUS,78,NÃO ELEITO
20666,EDER MARTINS CORREA,33,SUPLENTE
11,EDER LUIS CUNHA DE MELO,3727,NÃO ELEITO
27300,EDER JHOUFER PALHETA SANTA BRIGIDA,243,SUPLENTE
25013,EDER FERREIRA DO NASCIMENTO,51,SUPLENTE
45777,EDER DOS SANTOS ROBERTO,99,SUPLENTE
12007,EDER DE SOUZA TEIXEIRA,17,SUPLENTE
65123,EDER DA GAMA AZEVEDO,381,NÃO ELEITO
20,EDER AZEVEDO MAGALHÃES,8696,ELEITO
77777,EDER ANDREY LIRA RIBEIRO,13,SUPLENTE
50842,EDENILSON LIMA DA SILVA,19,NÃO ELEITO
15123,EDENILSON DOS ANJOS GOMES,192,SUPLENTE
25055,EDENILSON DE SOUSA SANTANA,69,SUPLENTE
14234,EDENILDA SOARES CUNHA,35,SUPLENTE
13651,EDENILCE   FERREIRA  RIBEIRO,44,SUPLENTE
12134,EDENIAS SOUSA OLIVEIRA,97,NÃO ELEITO
55003,EDEMIR SOUZA DOS SANTOS,101,SUPLENTE
15678,EDEMAR ONETTA,193,SUPLENTE
55122,EDEMAR OLIVEIRA GUIMARÃES,16,NÃO ELEITO
51100,EDEMAR DILL,76,SUPLENTE
11777,EDEM ELAM SILVA LOPES,146,SUPLENTE
12123,EDELTON REGIO PEREIRA DE ARAUJO,190,SUPLENTE
55345,EDELSON MATOS PRESTES,8,NÃO ELEITO
22222,EDELSON LIMA DO NASCIMENTO,351,SUPLENTE
15555,EDELSON DAVID DA SILVA VALLE,23,SUPLENTE
22777,EDELMA ALEXANDRE DA SILVA,118,SUPLENTE
50456,EDEGILSON FERREIRA BRANDÃO,63,NÃO ELEITO
28222,EDCLÉA FERREIRA DE AGUIAR,4,NÃO ELEITO
40123,EDCARLOS UCHOA SILVA CUNHA,784,ELEITO POR QP
12300,EDCARLOS DE SOUZA AZEVEDO,327,SUPLENTE
40455,EDA MARIA DOS SANTOS FERREIRA,19,SUPLENTE
