Numero_Candidato,Nome_Completo,Votos,Situacao
45222,ÍTALO BENEDITO DA CRUZ MAGALHÃES,186,SUPLENTE
12,ÉVERSON CARLOS QUARESMA DA SILVA,13995,NÃO ELEITO
43741,ÉRICA MARIA PANTOJA DE SOUZA,16,NÃO ELEITO
23555,ÉRICA DE MESQUITA REIS SOUSA,40,NÃO ELEITO
45555,ÉRICA ALVES FELIPE,25,SUPLENTE
45330,ÉLIO ALVES DE BARROS,203,SUPLENTE
40999,ÉDIPO LUIZ ALMEIDA DE SOUZA,181,SUPLENTE
36555,ÉDINA MAKLOUF GONÇALVES PEREIRA,20,NÃO ELEITO
45678,ÂNGELO NEVES DOS SANTOS,861,SUPLENTE
15333,ÂNGELA PEREIRA DA SILVA,0,SUPLENTE
15166,ÂNGELA MARIA SALDANHA FONSECA,13,SUPLENTE
77777,ÂNDRYA DE PAULA DE SOUZA GAMA GUEDES,287,NÃO ELEITO
50777,ÁUREA SENA DOS SANTOS,50,NÃO ELEITO
65,ÁUREA NINA MONTEIRO,285,NÃO ELEITO
28111,ÁTILA GARCIA DO VALE,9,NÃO ELEITO
20456,ÁDILA AMORIM DA SILVA ALMEIDA,254,SUPLENTE
90778,ZÓSIMO DE OLIVEIRA TAVARES,91,NÃO ELEITO
14444,ZÉLIA DA CUNHA XAVIER,91,SUPLENTE
10345,ZUVEIDE SILVA BEZERRA,333,ELEITO POR QP
15234,ZURAS SANTANA DE SOUZA,89,SUPLENTE
90612,ZULENE DOS SANTOS ARAUJO,502,NÃO ELEITO
12222,ZULEMA FERREIRA SILVA,356,ELEITO POR QP
45999,ZULEIDE JARDIM MARQUES,5,SUPLENTE
14333,ZULEIDE CAPISTANA DA SILVA,27,SUPLENTE
15,ZULEICA FABIANA KOLLING,7615,NÃO ELEITO
36321,ZOZY MIRANDA CORREA,0,NÃO ELEITO
55333,ZONEIDE FERREIRA BRITO,62,SUPLENTE
45999,ZOLEIDE GARCIA DA ROCHA,23,SUPLENTE
12555,ZITO FROES ALVES,194,SUPLENTE
15000,ZIRALDO DOS SANTOS MORAIS,216,SUPLENTE
15777,ZIONA JÚNIOR COSTA AZEVEDO,122,SUPLENTE
20002,ZIMAR FERNANDES DE PADUA,47,SUPLENTE
25456,ZILMAR SIRQUIEIRA DA SILVA,46,SUPLENTE
22123,ZILMAR DA SILVA MACHADO,65,NÃO ELEITO
90110,ZILMA MARGARETH DA SILVA SOUSA,117,SUPLENTE
15600,ZILMA LEITE DA SILVA SANTANA,147,SUPLENTE
22133,ZILMA FRANCISCA DE SOUSA,15,SUPLENTE
20255,ZILMA BRITO DE SOUSA,170,NÃO ELEITO
13345,ZILDO BALIEIRO TENÓRIO,58,SUPLENTE
35613,ZILDIANE DA SILVA PANTOJA,9,NÃO ELEITO
20000,ZILDETE NUNES SODRÉ,67,SUPLENTE
15789,ZILDA MARQUES DA SILVA,8,SUPLENTE
17123,ZILDA GONÇALVES DA SILVA,54,NÃO ELEITO
43110,ZILDA CARLA SANTOS SILVA,23,SUPLENTE
20555,ZILANDA MONTEIRO FERREIRA,287,SUPLENTE
10555,ZILAH LIMA DOS REIS,2,NÃO ELEITO
36700,ZILA RIBEIRO SANTOS,2,NÃO ELEITO
10000,ZICO TRINDADE PIRES,322,SUPLENTE
55234,ZEZINHA DA SILVA E SOUZA,0,SUPLENTE
55016,ZEZAIAS QUEIROZ COELHO,121,SUPLENTE
13513,ZEULI ALBUQUERQUE NASCIMENTO,74,SUPLENTE
45777,ZEREDA PANTOJA DE LIMA,39,SUPLENTE
90666,ZENÁRIA BARBOSA STABENOW,9,SUPLENTE
40333,ZENUNES COSTA E SILVA,9,SUPLENTE
36987,ZENOBIO JARLSON MELO SERIQUE,13,NÃO ELEITO
65100,ZENOBIO DE SOUZA VIEIRA,1,SUPLENTE
14321,ZENITO LOPES DA COSTA,54,SUPLENTE
50123,ZENITO FARIAS DE MELO,62,NÃO ELEITO
15555,ZENILTON BONFIM MARIS,249,SUPLENTE
55022,ZENILTON ALBUQUERQUE LIRA,117,SUPLENTE
15100,ZENILSON DA SILVA,1023,ELEITO POR QP
20100,ZENILDO SAW MUNDURUKU,47,SUPLENTE
27000,ZENILDO CAVALCANTE MIRANDA JUNIOR,115,NÃO ELEITO
13133,ZENILDA TEIXEIRA DOS SANTOS,11,NÃO ELEITO
19099,ZENILDA OLIVEIRA DE MATOS,15,SUPLENTE
90456,ZENILDA BARROS DE JESUS RODRIGUES,26,SUPLENTE
15000,ZENI OLIVEIRA DA CUNHA,198,NÃO ELEITO
19789,ZENALDO MARTINS PORTAL,237,SUPLENTE
10111,ZENAIDE VITAL DA SILVA,20,SUPLENTE
40222,ZENAIDE SOUZA DE JESUS,11,NÃO ELEITO
25333,ZENAIDE PACHECO DE LIMA,364,ELEITO POR QP
19777,ZENAIDE GOMES DA CONCEICAO CASTRO,27,NÃO ELEITO
17132,ZELMA ZEVONI PEREIRA ABNADER,11,NÃO ELEITO
13456,ZELIÃO LUNA ALENCAR,100,NÃO ELEITO
51752,ZELIETE NASCIMENTO CARDOSO,2,NÃO ELEITO
22011,ZEILA BERNARDES DOS SANTOS,13,SUPLENTE
15777,ZEDEQUIAS SALES DOS SANTOS,625,ELEITO POR QP
90567,ZEANE TEIXEIRA PINHEIRO,46,SUPLENTE
20333,ZAYRE AUGUSTO DE JESUS SOUZA,339,ELEITO POR MÉDIA
13456,ZAQUEU SILVA CATARINO,202,NÃO ELEITO
40333,ZAQUEU GOMES ANDRADE,32,SUPLENTE
15100,ZAQUEU DE OLIVEIRA MONTEIRO,53,SUPLENTE
43456,ZAQUEU DAMASCENO LANOA,70,SUPLENTE
51234,ZAQUEL PEREIRA DA SILVA,261,NÃO ELEITO
20001,ZANDERLAN ANTÔNIO FERREIRA,11,SUPLENTE
13999,ZAIRO GOMES DA COSTA BENJO,120,NÃO ELEITO
15122,ZAIRE MENESES DIAS,16,SUPLENTE
22333,ZACARIAS RIBEIRO,144,SUPLENTE
13023,ZACARIAS PRIST TEIXEIRA,9,NÃO ELEITO
20009,ZACARIAS DE SOUZA GOMES,34,SUPLENTE
15150,ZACARIAS CHAGAS MONTEIRO FILHO,36,SUPLENTE
14333,ZACARIAS BARROS PIEDADE JUNIOR,83,SUPLENTE
17777,YÊDA MIRANDA VASCONCELOS,28,SUPLENTE
13250,YURY ROBERTO DIAS,12,SUPLENTE
55678,YURI RAILAN ALMEIDA GUEDES,43,SUPLENTE
10222,YURI ORLANDO GOMES BASTOS,354,SUPLENTE
70555,YURI INACIO FERREIRA,55,NÃO ELEITO
45550,YUME DANNA CARVALHO PINTO,218,SUPLENTE
77555,YULLI AVILA DA SILVA,39,SUPLENTE
17566,YSLAIANA CONCEICAO CARNEIRO DE PAULA,0,SUPLENTE
20977,YRECÊ SERRA DA SILVA SANTOS,1,NÃO ELEITO
15777,YGOR DO CARMO SILVA,201,SUPLENTE
55999,YEDA DO SOCORRO NONATO MACHADO,0,NÃO ELEITO
19225,YASMIN GARCIA SANTANA,1,NÃO ELEITO
22,YARA MOITINHO BOMFIM,266,NÃO ELEITO
15555,YANNÊ DO SOCORRO GAMA OLIVEIRA,510,SUPLENTE
11123,YANGLYER GLAY SANTOS MATTOS,248,SUPLENTE
51234,YANDALLA RODRIGUES FARIAS,135,NÃO ELEITO
25555,YAN TEIXEIRA MIRANDA NUNEZ,208,SUPLENTE
90545,YAN JOSE DO NASCIMENTO CHAVES,8,SUPLENTE
40149,YACTA MARIA REBELO VIANA,140,SUPLENTE
14057,XETERIA PARAKANÃ,28,SUPLENTE
51234,XERE KAYAPO,165,SUPLENTE
43888,WSDENBORG BORGES VIEIRA,92,SUPLENTE
20567,WMARINERGES DA CONCEIÇAO LOPES RAIOL,24,SUPLENTE
45453,WLLISSES BAIA ALVES,76,SUPLENTE
20555,WLICLEIDES PEREIRA SOARES,283,ELEITO POR QP
90111,WLADSON FRANÇA COUTO,20,NÃO ELEITO
65567,WLADISON DA CONCEIÇÃO FRANCO,95,SUPLENTE
15678,WLADIMIR CONCEIÇÃO COSTA,214,ELEITO POR MÉDIA
23111,WITALO JOSÉ ARAÚJO DE OLIVEIRA,550,ELEITO POR MÉDIA
70766,WISTLER JOSE MACHADO FERNANDES FILHO,101,NÃO ELEITO
50131,WISNTON MOURA DE MENEZES,57,SUPLENTE
17123,WIRATON RESENDE DA SILVA,215,ELEITO POR MÉDIA
43007,WILTON OEDSON MARQUES DE OLIVEIRA,16,NÃO ELEITO
15,WILTON MIRANDA DE LIMA,2179,ELEITO
20000,WILTON JURIQUES BARROS,159,SUPLENTE
14789,WILTES GOMES DIAS,989,ELEITO POR MÉDIA
14444,WILSONEIDE DA SILVA LIMA,14,NÃO ELEITO
25456,WILSON XAVIER GUIMARÃES,282,SUPLENTE
51555,WILSON VIEIRA LIMA,71,SUPLENTE
17000,WILSON SOARES ROSA,384,ELEITO POR QP
15115,WILSON SERGIO DOS SANTOS SILVA,221,SUPLENTE
13123,WILSON SARAIVA NABATE,161,SUPLENTE
14777,WILSON RODRIGUES ARAÚJO,592,SUPLENTE
15015,WILSON PEREIRA DE SOUZA,51,SUPLENTE
22190,WILSON PEREIRA DE CARVALHO,53,NÃO ELEITO
10456,WILSON PAULINO DOS SANTOS,437,ELEITO POR MÉDIA
19019,WILSON MOREIRA GARCIA,86,NÃO ELEITO
22200,WILSON MENDES DO CARMO,42,SUPLENTE
15555,WILSON MATOS DE BRITO FILHO,725,SUPLENTE
77234,WILSON LUIZ DE ARAUJO SILVA,91,SUPLENTE
20800,WILSON LOPES DA SILVA,624,ELEITO POR MÉDIA
15222,WILSON FERREIRA DA SILVA,394,SUPLENTE
13222,WILSON DO SOCORRO REIS AMORIM,83,NÃO ELEITO
19666,WILSON DANTAS DE BRITO,136,SUPLENTE
10777,WILSON DA SILVA REZENDE,216,SUPLENTE
10222,WILSON DA SILVA JORDÃO FILHO,5,NÃO ELEITO
10237,WILSON DA SILVA,19,NÃO ELEITO
15555,WILSON CÃMARA FRAZÃO FILHO,404,SUPLENTE
22123,WILSON CRUZ DIAS,116,NÃO ELEITO
43123,WILSON CORDEIRO ALBUQUERQUE NETO,231,NÃO ELEITO
50222,WILSON CLEBSON SILVA DOS SANTOS,413,NÃO ELEITO
43678,WILSON CHAVES PANTOJA,11,SUPLENTE
25500,WILSON CEZAR BARROSO SARGES,316,SUPLENTE
65789,WILSON CARLOS ARAÚJO,9,NÃO ELEITO
40545,WILSON ARAÚJO BARROS,16,SUPLENTE
45045,WILMON MOTA MARTINS,1232,ELEITO POR MÉDIA
43333,WILMAR DE OLIVEIRA CABRAL,25,SUPLENTE
15200,WILMAR ALVES LOBO,108,SUPLENTE
90213,WILMA KARINA DOS SANTOS CARDIAS BEZERRA,11,SUPLENTE
20115,WILMA FREIRE DE ARAÚJO,110,SUPLENTE
10101,WILMA DE ARAUJO NEVES,7,SUPLENTE
10172,WILMA DA SILVA CARVALHO,16,SUPLENTE
19555,WILMA CRISTINA CORREA SOARES,46,SUPLENTE
17051,WILLYS CAMPOS TAVARES,17,NÃO ELEITO
20300,WILLSMAYLEN DE SOUSA BRANDÃO CARNEIRO,19,SUPLENTE
25255,WILLON BRENNO NASCIMENTO DE SOUZA,461,SUPLENTE
77666,WILLISSES DOS SANTOS CARVALHO,38,NÃO ELEITO
25369,WILLIBRAM RAATZ BARCELLOS,26,SUPLENTE
22021,WILLIAN SILVA DE CARVALHO,19,SUPLENTE
51222,WILLIAN GALVÃO DE PAIVA,99,NÃO ELEITO
10111,WILLIAN BRUNO PAIVA,23,SUPLENTE
22798,WILLIAN ANDREY RODRIGUES ALVES,0,SUPLENTE
20222,WILLIAMS FRANÇA VALENTE,160,SUPLENTE
10101,WILLIAMS ANTONIO DE LIMA,33,SUPLENTE
55000,WILLIAMAR SOARES DE SOUSA,511,SUPLENTE
43210,WILLIAM ROMARIO SOUZA FARIAS,4,NÃO ELEITO
25111,WILLIAM MARIA DINIZ,13,SUPLENTE
22001,WILLIAM LIMA MENDES,1026,SUPLENTE
14555,WILLIAM DE ABREU CRUZ,37,SUPLENTE
15400,WILLIAM CARDOSO DA CUNHA,39,SUPLENTE
90600,WILLEN SIQUEIRA DOS ANJOS,91,SUPLENTE
15444,WILLEN LIMA GUEDELHA,373,SUPLENTE
17777,WILLDGLAND PEREIRA  DE ARRUDA,22,NÃO ELEITO
15222,WILLAME PEREIRA TEIXEIRA,23,SUPLENTE
19303,WILLAME CORTEZ RODRIGUES,28,SUPLENTE
25123,WILKERSON SANTOS DA SILVA SARGES,835,ELEITO POR QP
19077,WILKENS JOSÉ DA COSTA MARTINS,8,SUPLENTE
20555,WILKA GUIMARAES NOLASCO,177,SUPLENTE
13345,WILKA FERREIRA LIMA,12,NÃO ELEITO
45666,WILISMAR DATIE DE SOUSA,172,SUPLENTE
22345,WILIO JOSE DA SILVA RAMOS,118,SUPLENTE
17115,WILIAN ALVES DA SILVA,258,SUPLENTE
15000,WILIAMS BECKMANN DA SILVA PINHEIRO,472,SUPLENTE
19555,WILERCIO RENAN PINTO RODRIGUES,39,NÃO ELEITO
15,WILDSON ARAÚJO DE MELLO,6075,NÃO ELEITO
12789,WILDER CLELSO RODRIGUES COSTA,28,SUPLENTE
55055,WILDER AMINTAS LISBOA POMPEU,249,SUPLENTE
15222,WILDENBERG MELO SOUSA,533,ELEITO POR QP
51555,WILDELEON CHAVES DA SILVA,44,NÃO ELEITO
45555,WILAME PEDROZA SANTOS,609,ELEITO POR QP
12111,WILAESIO DE PAIVA OLIVEIRA,157,SUPLENTE
14556,WHYGO LINYKE LISBOA DE ANDRADE,188,SUPLENTE
50,WHISNEY LUIZ PEREIRA MESSIAS,956,NÃO ELEITO
13,WHEBERTON ALUIZIO BONFIM ARAUJO,1216,NÃO ELEITO
55000,WHANDEILON DE CARVALHO SANTOS,1337,ELEITO POR QP
22222,WEVERTTON VICENTE COELHO,901,ELEITO POR QP
15777,WEVERTON MOREIRA VITAL,227,SUPLENTE
22123,WEUDEL DA SILVA NEVES,133,SUPLENTE
40200,WESTERNING FLOR DE LIMA JUNIOR,241,SUPLENTE
40333,WESNEY SILVA FELIPE,67,SUPLENTE
10456,WESLLEY SOARES DA SILVA,229,SUPLENTE
22123,WESLEY TIAGO FERNANDES LIMA,77,NÃO ELEITO
20000,WESLEY SOBRINHO TRINDADE,95,NÃO ELEITO
13813,WESLEY SILVA LOPES,22,NÃO ELEITO
14145,WESLEY RIBEIRO DE SOUSA,132,SUPLENTE
10234,WESLEY DA SILVA MARTINS,8,NÃO ELEITO
15151,WESLEI RODRIGUES NASCIMENTO,31,SUPLENTE
15200,WESCLEY SILVA AGUIAR,1722,ELEITO POR QP
22123,WERMESON SOUSA GOMES,194,SUPLENTE
45777,WERLLEY DE ALENCAR OLIVEIRA,13,SUPLENTE
45678,WERLESON DA SILVA MORAES,231,SUPLENTE
25000,WERLES SANTOS SILVA,256,ELEITO POR QP
51510,WERICLIS GUSTAVO BALEEIRO PINHEIRO,130,SUPLENTE
19000,WERBTI SOARES GAMA,126,SUPLENTE
12369,WENILTON SILVA CAVALCANTE,448,NÃO ELEITO
55007,WENDY BRENO RODRIGUES PALHETA,536,ELEITO POR QP
22122,WENDESON LAURINDO DE OLIVEIRA,1356,ELEITO POR QP
90500,WENDERSON RAMALHO MULATO,528,ELEITO POR QP
15888,WENDERSON MORAES QUARESMA,813,SUPLENTE
13013,WENDERSON FIGUEIRA RIBEIRO,26,SUPLENTE
51200,WENDER RODRIGUES CAMPOS,94,NÃO ELEITO
22345,WENDER ODINALDO BARROS DA SILVA,39,SUPLENTE
45999,WENDER DO NASCIMENTO GOBIRA,21,SUPLENTE
77123,WENDEO JOSE AIRES PEREIRA,20,NÃO ELEITO
40555,WENDELL JOSE BARBOSA SILVA,17,NÃO ELEITO
45111,WENDELL DA SILVA ROCHA,4,SUPLENTE
25678,WENDEL VALBER GOMES AMADOR,88,NÃO ELEITO
17100,WENDEL LUÍS OLIVEIRA DE SOUSA,135,SUPLENTE
45444,WEMES FERRAZ DA SILVA,117,SUPLENTE
55051,WEMBLEY LEMOS DE FARIAS,18,SUPLENTE
77111,WELYSON ALLEN MARTINS RECHENE,16,SUPLENTE
17198,WELVES DOS SANTOS SILVA,68,SUPLENTE
15000,WELTON SANTOS MAIA DA SILVA,228,SUPLENTE
20123,WELTON MARLON DA SILVA COSTA,825,ELEITO POR QP
77347,WELTON COSTA PEREIRA,11,SUPLENTE
25355,WELTON COSTA DE OLIVEIRA,47,SUPLENTE
43,WELSON JOSE SANTOS DE ARRUDA,36,NÃO ELEITO
43210,WELLYNGTON SALES DA SILVA,33,SUPLENTE
45045,WELLITON WAGNER DA SILVA DOS REIS,212,SUPLENTE
20888,WELLITON SOARES DE PINA,13,SUPLENTE
10123,WELLITON PAULO CASTILHO SANTOS,152,NÃO ELEITO
20123,WELLITON FERREIRA ORBANO,819,ELEITO POR QP
14014,WELLITON DE CASTRO GOMES,196,SUPLENTE
90555,WELLITON DAS CHAGAS FERREIRA,22,NÃO ELEITO
17022,WELLISON WENDELL NEVES LIMA,0,NÃO ELEITO
70444,WELLINGTON SILVA DO NASCIMENTO,142,SUPLENTE
12345,WELLINGTON SALES PEREIRA,375,SUPLENTE
77123,WELLINGTON RODRIGO CARDOSO,272,SUPLENTE
55789,WELLINGTON RIBEIRO ALVES,176,SUPLENTE
15455,WELLINGTON PROGENIO MAGALHÃES,722,SUPLENTE
40123,WELLINGTON MICHAEL MIRANDA PINHEIRO,319,NÃO ELEITO
15000,WELLINGTON LEITE DOS SANTOS NETO,296,ELEITO POR QP
12456,WELLINGTON JOSÉ DE SOUZA SARMENTO,45,SUPLENTE
22555,WELLINGTON FERNANDO DOS SANTOS SOUZA,171,SUPLENTE
70030,WELLINGTON FABRICIO ROSTAND CHAVES,23,NÃO ELEITO
12222,WELLINGTON DE SOUZA VELOSO,15,SUPLENTE
10999,WELLINGTON DE SOUSA FLORENCIO,3,SUPLENTE
43222,WELLINGTON DA SILVA LIMA,414,SUPLENTE
12555,WELLINGTON CORREIA DE MIRANDA,88,SUPLENTE
50444,WELLINGTON CARLOS HENRIQUES MARTINS,45,SUPLENTE
15115,WELLINGTON CARLOS DE OLIVEIRA,4,NÃO ELEITO
19444,WELLINGTON ACIDIO CASTRO PEREIRA SILVA,132,SUPLENTE
22433,WELLINGHTON TELES LIMA,124,SUPLENTE
22555,WELLIGTON RENATO DOS SANTOS COSTA,373,SUPLENTE
55555,WELLIGTON MOURÃO,158,NÃO ELEITO
45100,WELLES ROSA DE JESUS,428,ELEITO POR QP
19000,WELLES OLIVEIRA MIRANDA,356,NÃO ELEITO
13013,WELLENSON COLARES CASTRO,126,NÃO ELEITO
15444,WELKUER MOURA LEÃO,517,SUPLENTE
40000,WELKE REIS MARTINS,99,SUPLENTE
15333,WELITONN RAMOS DA SILVA,17,SUPLENTE
77777,WELITON RODRIGUES GONÇALVES,11,NÃO ELEITO
22333,WELITON RODRIGUES DE CARVALHO,54,SUPLENTE
22022,WELITON MELO LIMA,448,ELEITO POR QP
17000,WELITON LOPES DE SOUZA,269,SUPLENTE
13222,WELITON DOS SANTOS SANTANA,89,SUPLENTE
25318,WELITON CANCIO DE FARIAS,117,SUPLENTE
55222,WELITON BRANDÃO DA SILVA,430,ELEITO POR QP
25888,WELISON MELO DE SOUZA,568,SUPLENTE
14325,WELISON DOS SANTOS RAMOS,11,SUPLENTE
55555,WELISMAR MULATO DE SOUZA,651,ELEITO POR MÉDIA
14014,WELINTON SILVA CHAGAS,20,NÃO ELEITO
23333,WELINTON JOSÉ EUGÊNIO,15,NÃO ELEITO
15222,WELINGTON FARIA DA COSTA,422,ELEITO POR MÉDIA
10888,WELINGTON DA SILVA CUNHA,363,ELEITO POR QP
45333,WELIGTON AMARAL SANTOS,35,SUPLENTE
11269,WELIGHNTON CESAR ARAUJO DE ASSIS,10,NÃO ELEITO
23999,WELHIA DA SILVA MORAIS GOUVEIA,25,NÃO ELEITO
15380,WELDES DE JESUS APOLINÁRIO,253,SUPLENTE
45000,WELDER CAMARGO DE OLIVEIRA,65,SUPLENTE
10111,WELCKSON SOUSA MARINHO,93,NÃO ELEITO
90100,WELBER BARATA PEREIRA,30,SUPLENTE
15,WEDER MAKES CARNEIRO,6708,ELEITO
10125,WEDER CAMILO GOMES VAZ,32,NÃO ELEITO
14222,WECIA DE MELO DANTAS FIUZA,35,SUPLENTE
13111,WEBSON ALVES CARVALHO,24,SUPLENTE
51777,WEBER DE SOUSA LEÃO,40,NÃO ELEITO
19100,WEBER DA SILVA GALVAO,688,ELEITO POR MÉDIA
12333,WAUDYLLA KERLEY RODRIGUES PEREIRA BARROS,2,NÃO ELEITO
23000,WATILA SOUZA SILVA,12,SUPLENTE
17000,WASHINGTON SANTOS DE OLIVEIRA,726,ELEITO POR MÉDIA
17456,WASHINGTON RODRIGUES RIOS,11,NÃO ELEITO
18219,WASHINGTON MORENO MENEZES,86,SUPLENTE
11555,WASHINGTON LUIS ARAGÃO DAS DORES,118,NÃO ELEITO
36,WASHINGTON JORGE RODRIGUES BARBOSA,349,NÃO ELEITO
65336,WASHINGTON DA SILVA ALBANO,10,NÃO ELEITO
15222,WASHINGTON COSTA DE ALBUQUERQUE,840,ELEITO POR QP
10200,WASHINGTON ALMEIDA DA SILVA,39,SUPLENTE
51111,WARLLES RIBEIRO DA SILVA,68,NÃO ELEITO
10510,WARLISON SOUZA DE OLIVEIRA,8,NÃO ELEITO
55066,WARLISON BARROS DA SILVA,152,SUPLENTE
25678,WARLEY ROSA DA SILVA,78,SUPLENTE
77100,WARLEY PIRES CINTRA,5,NÃO ELEITO
10017,WARLEY ALBERTO CLAUHS,53,SUPLENTE
25333,WARLEN SANTOS,695,ELEITO POR QP
90001,WARLEM GIL DE JESUS LIMA,56,SUPLENTE
18988,WANUSA SILVA BOTELHO SOEIRO,7,NÃO ELEITO
65123,WANIA VAZ NASCIMENTO,139,SUPLENTE
45222,WANIA SIMONE SOARES DA SILVA,37,SUPLENTE
23888,WANIA APARECIDA DA SILVA SANTOS,20,SUPLENTE
12812,WANESSA SILVA GOMES,0,SUPLENTE
77999,WANESSA MAGALY DOS SANTOS LEAL,12,SUPLENTE
43043,WANDSON MOACIR CORREA DE OLIVEIRA,1447,ELEITO POR MÉDIA
19234,WANDSON DE SOUSA SILVA,45,SUPLENTE
15,WANDO WILLER DA SILVA TEIXEIRA,2829,NÃO ELEITO
40175,WANDLAS OLIVEIRA DO ROSÁRIO,262,SUPLENTE
77555,WANDILSON SOUSA DA TRINDADE,52,SUPLENTE
12444,WANDERSON WENDELL VASCONCELOS PINTO,128,NÃO ELEITO
45200,WANDERSON SANTOS CHAVES,63,SUPLENTE
10444,WANDERSON PASSON DA SILVA,453,ELEITO POR MÉDIA
40123,WANDERSON MOREIRA SIMOES,97,SUPLENTE
15111,WANDERSON JUNIOR SILVA BORGES,1466,ELEITO POR QP
19000,WANDERSON JOSE BRAGA,18,NÃO ELEITO
45024,WANDERSON GONÇALVES DE ALCÂNTARA,10,NÃO ELEITO
22000,WANDERSON FERNANDES DE ARAUJO,138,SUPLENTE
13100,WANDERSON DE ALMEIDA,20,NÃO ELEITO
22222,WANDERSON DA SILVA PEREIRA,80,SUPLENTE
43043,WANDERSON COSTA DA CONCEIÇÃO,25,NÃO ELEITO
45678,WANDERSON APARECIDO DELMONDES,827,ELEITO POR QP
45222,WANDERSON ALVES PINHEIRO,733,ELEITO POR MÉDIA
23222,WANDERLISE DE CASTRO GOMES,296,SUPLENTE
20400,WANDERLEY SANTOS ROZARIO,7,SUPLENTE
25125,WANDERLEY FRANCISCO DE SOUSA,90,SUPLENTE
15120,WANDERLEY DA SILVA SANTOS,464,SUPLENTE
25777,WANDERLEIA DE JESUS PAES BARRETO,22,SUPLENTE
33333,WANDERLEI SOARES DA CONCEIÇÃO,64,NÃO ELEITO
40999,WANDERLEI NOGUEIRA DE SOUSA,417,SUPLENTE
12121,WANDERLEI LOPES DE SOUSA,3,NÃO ELEITO
15111,WANDERLEI DA COSTA CAVALCANTE,522,ELEITO POR QP
14000,WANDERLEI CUNHA MENDONÇA,52,SUPLENTE
15612,WANDERLEI CARDOSO CARRERA,60,SUPLENTE
90321,WANDERLEA PAIVA,198,SUPLENTE
19000,WANDERCLEI PINHEIRO DOS SANTOS,85,SUPLENTE
12,WANDER NUNES DE RESENDE,408,NÃO ELEITO
36799,WANDER LUCIO DA CONCEIÇÃO NUNES,39,SUPLENTE
20000,WANDELMO WILLAME OLIVEIRA,276,SUPLENTE
22888,WANDEIR COIMBRA NOLETO,303,SUPLENTE
36999,WANDACLEA  CORREA FIGUEIREDO,34,SUPLENTE
14117,WANDA LUCIANA VAZ DA SILVA FARIAS,22,SUPLENTE
55000,WAMILTON GOMES FERREIRA,113,NÃO ELEITO
22222,WALYSON MATHEUS SOUSA PESSOA,976,ELEITO POR QP
15678,WALTO SANTOS CUNHA,841,ELEITO POR QP
77007,WALTINHO SOUSA DOS SANTOS,1,NÃO ELEITO
22333,WALTERLY MARCOS MARINHO WANDERLEY,245,SUPLENTE
22333,WALTER SOARES GOMES,414,ELEITO POR MÉDIA
10140,WALTER SERRA TEIXEIRA,96,SUPLENTE
14555,WALTER SANTA BRÍGIDA MACHADO,215,SUPLENTE
15555,WALTER ROCHA LEAL JUNIOR,7,SUPLENTE
13777,WALTER POWCI WAI WAI,43,NÃO ELEITO
10110,WALTER PIRES DE ARAUJO,66,SUPLENTE
13130,WALTER PEREIRA CAMPOS DELUQUI,26,SUPLENTE
15123,WALTER JUNIOR CASTRO MARÇAL,253,SUPLENTE
20,WALTER JOSÉ DA SILVA,4016,NÃO ELEITO
20000,WALTER GARCIA MORTALVÃO,24,NÃO ELEITO
10000,WALTER FRAZAO JUNIOR,3,SUPLENTE
23023,WALTER FERREIRA RODRIGUES,3,NÃO ELEITO
77123,WALTER EVANDRO VAZ DO NASCIMENTO,229,SUPLENTE
17700,WALTER DONATO FERNANDES LEITAO,22,NÃO ELEITO
45900,WALTER DE ALMEIDA ARAÚJO,394,SUPLENTE
90888,WALTER DA SILVA OEIRAS,802,ELEITO POR QP
40007,WALTER BONFIM MARQUES,66,SUPLENTE
45156,WALTENCI NOGUEIRA DE OLIVEIRA,101,SUPLENTE
20201,WALSON PEREIRA DE SOUZA,10,SUPLENTE
40100,WALQUIRIA CRISTINA BATISTA ALVES BARBOSA,27,SUPLENTE
10456,WALMY CESAR COSTA RODRIGUES,639,ELEITO POR QP
20279,WALMIR RODRIGUES DA COSTA,114,SUPLENTE
13151,WALMIR GRACEZ MACHADO,16,NÃO ELEITO
14192,WALMIR DE SOUSA XAVIER JUNIOR,87,SUPLENTE
20777,WALLYNSON CALAZANS VIANA,19,SUPLENTE
11165,WALLISON MARCIO DOS SANTOS,84,SUPLENTE
90222,WALLAN CLEYBER DOS SANTOS VAZ,112,SUPLENTE
51000,WALLACE PEREIRA DE CASTRO,13,NÃO ELEITO
50050,WALLACE BARROS DA COSTA,72,NÃO ELEITO
25999,WALKIRIA BARBOSA DOS SANTOS,15,SUPLENTE
77888,WALKIANE DE SOUZA CORREA,172,NÃO ELEITO
17222,WALISSON DIAS KUPERTINO,70,SUPLENTE
15155,WALISON SANTOS DE CASTRO,282,SUPLENTE
15333,WALISON DE SOUZA CARDOSO,420,SUPLENTE
40721,WALGNER TARCISIO SANTIAGO CARDOSO,20,SUPLENTE
55101,WALFREDO MADEIRA NUNES,40,NÃO ELEITO
15215,WALFIR ARAUJO PEREIRA,452,SUPLENTE
65222,WALESON DE MORAES FERREIRA,45,NÃO ELEITO
70139,WALESKA MAY GIRARD PEREIRA,5,SUPLENTE
13130,WALDSON DO ESPIRITO SANTO PRESTES ESPINDOLA,926,ELEITO POR QP
55456,WALDRIANA DOS ANJOS DE MELO,735,ELEITO POR QP
11800,WALDOMIRO YARED FERREIRA,465,SUPLENTE
15605,WALDOMIRO CORDEIRO SOARES,451,ELEITO POR QP
17123,WALDOLIRIO IBIAPINA AZEVEDO CARVALHO,5,NÃO ELEITO
22666,WALDO PINTO PINHEIRO,200,SUPLENTE
12345,WALDIZA SAURE,53,SUPLENTE
14777,WALDIVINO ETERNO CARDOSO,223,SUPLENTE
25018,WALDIRENE FERREIRA MARTINS,0,SUPLENTE
36111,WALDIRENE DA SILVA COSTA CARVALHO,12,NÃO ELEITO
20999,WALDIRENE DA COSTA OLIVEIRA,15,SUPLENTE
30030,WALDIRENE CASTRO DE ANDRADE,29,NÃO ELEITO
55022,WALDIR SALES SANTOS,265,SUPLENTE
36777,WALDIR PALHETA ALVES,21,NÃO ELEITO
13122,WALDIR FERNANDES BARBOSA,418,ELEITO POR QP
13300,WALDIR DE MORAES PAZ,77,SUPLENTE
35555,WALDIR DE CRISTO MIRANDA,5,NÃO ELEITO
20231,WALDIR ALVES DOS SANTOS,64,SUPLENTE
12667,WALDINEZ BARROSO FERREIRA,28,SUPLENTE
19,WALDINEY PIRES MORAES,562,NÃO ELEITO
45000,WALDINETE DOS SANTOS VIANA,7,SUPLENTE
90456,WALDINEI ALVES ALENCAR,51,SUPLENTE
25500,WALDIMIR CRAVEIRO LEAL JUNIOR,18,SUPLENTE
15999,WALDILENE NEVES DE ALMEIDA,114,SUPLENTE
43243,WALDILENA ASSUNÇÃO,42,NÃO ELEITO
14555,WALDICO CASSIANO DA SILVA,105,SUPLENTE
17,WALDERLY LEAL CARVALHO,62,NÃO ELEITO
19159,WALDERINA GONÇALVES GOMES,4,SUPLENTE
70789,WALDENIZE PINHEIRO BARBOSA,25,SUPLENTE
20,WALDENICE GOMES RODRIGUES SILVA,157,NÃO ELEITO
55365,WALDENICE BARATA,17,NÃO ELEITO
25013,WALDENEZA MELO DE ANDRADE,9,SUPLENTE
20200,WALDENE NASCIMENTO DE SOUZA,127,SUPLENTE
77001,WALDEMIRO ASSIS GOMES NEGREIROS,353,NÃO ELEITO
15315,WALDEMIR PEDRO DE SOUSA,77,SUPLENTE
22222,WALDEMIR OLIVEIRA FERREIRA,123,NÃO ELEITO
20999,WALDEMIR OLIVEIRA DA COSTA,487,ELEITO POR MÉDIA
23000,WALDEMIR LISBOA E SILVA NETO D IPPOLITO,416,NÃO ELEITO
22102,WALDEMIR DE LIMA,5,NÃO ELEITO
20777,WALDEMIR DA SILVA SANTOS,27,NÃO ELEITO
11234,WALDEMIR COSTA RODRIGUES,149,SUPLENTE
22123,WALDEMIR AUGUSTO DA SILVA MACIEL,281,SUPLENTE
90456,WALDEMAR NOGUEIRA DE OLIVEIRA NETO,80,SUPLENTE
23655,WALDEMAR JOSÉ RAMOS SOARES,9,SUPLENTE
13013,WALDEMAR JOSE DA SILVA JUNIOR,73,NÃO ELEITO
36,WALDEMAR DE CASTRO NUNES FILHO,697,NÃO ELEITO
19888,WALDELUCIO PEREIRA DA COSTA,53,SUPLENTE
22000,WALDELICE ALVES DOS SANTOS SOUSA,93,SUPLENTE
13455,WALDEGNO DE JESUS RODRIGUES MACHADO,10,SUPLENTE
15015,WALDECYR LEAL DOS SANTOS,15,SUPLENTE
13000,WALDECY PEREIRA DE CARVALHO,46,NÃO ELEITO
55000,WALDECY NUNES DOS SANTOS,1125,ELEITO POR MÉDIA
51234,WALDECY CORREA MACHADO,126,SUPLENTE
70333,WALDECIR XAVIER,11,NÃO ELEITO
35123,WALDECIR PINHEIRO DA SILVA,4,NÃO ELEITO
25123,WALDECI GONÇALVES SUSSUARANA,13,SUPLENTE
40456,WALCICLEY RODRIGUES LAVOR,18,NÃO ELEITO
40159,WALBER WILLIAM COELHO COSTA,18,SUPLENTE
10321,WALBER SOUSA SILVA,10,NÃO ELEITO
15986,WALBER PRESTES DA SILVA,68,SUPLENTE
45111,WALBER PACHECO SILVA,556,SUPLENTE
45,WALBER NOGUEIRA E SILVA JUNIOR,5758,NÃO ELEITO
45112,WALBER NOGUEIRA E SILVA,350,SUPLENTE
22000,WALBER FERREIRA PAMPLONA,179,NÃO ELEITO
40321,WALACE RABELO BRAGA,139,SUPLENTE
15600,WAINYLEILA MARIA DA SILVA DE CARVALHO,155,SUPLENTE
14888,WAGNER VALES DA SILVA,50,NÃO ELEITO
22122,WAGNER SILVA MENDONÇA,146,SUPLENTE
23235,WAGNER SILVA E SILVA,7,SUPLENTE
15844,WAGNER SABINO DA SILVA,89,SUPLENTE
65678,WAGNER REIS CARVALHO,17,NÃO ELEITO
25551,WAGNER QUEIROZ DE ARRUDA,16,SUPLENTE
25333,WAGNER PONTES MAGALHÃES,382,SUPLENTE
45888,WAGNER PEREIRA SIMÃO,141,SUPLENTE
45123,WAGNER PEREIRA DE PEREIRA,342,ELEITO POR QP
19789,WAGNER OLIVEIRA DA SILVA,25,NÃO ELEITO
25555,WAGNER MORGAN LOPES,210,SUPLENTE
22100,WAGNER MARTINS DOS SANTOS,391,SUPLENTE
55222,WAGNER LUIZ PEREIRA,53,NÃO ELEITO
15400,WAGNER JOSÉ SILVA DO NASCIMENTO,162,SUPLENTE
15101,WAGNER JOSE PEREIRA MONTEIRO,9,SUPLENTE
10000,WAGNER DOS SANTOS MOREIRA,249,NÃO ELEITO
11600,WAGNER DE PAIVA PINHEIRO,111,SUPLENTE
13,WAGNER DE CASTRO TAVARES,3780,NÃO ELEITO
12000,WAGNER DAMASCENO GERHARDT,55,SUPLENTE
55777,WAGNER BANDEIRA OLIVEIRA,128,SUPLENTE
10,WAGNER BACH MARTINS,4141,NÃO ELEITO
15100,WAGNER ANDRESSON PANTOJA,41,SUPLENTE
19999,WAGNER ALVES FEITOSA,149,NÃO ELEITO
90111,WAGNER ALVES CARVALHO,603,ELEITO POR MÉDIA
20555,WADSON LEÔNCIO OLIVEIRA DO NASCIMENTO,99,NÃO ELEITO
13333,WACSOM DE SOUZA ALVES,69,NÃO ELEITO
10777,VÂNZILA FERNANDES DA ROCHA,48,SUPLENTE
13323,VÂNIA LUCIA ABREU,5,SUPLENTE
55777,VÂNIA LOPES FEITOSA,10,SUPLENTE
22777,VÂNIA DO SOCORRO RIBEIRO BRANDÃO,7,SUPLENTE
10152,VONEIDE RODRIGUES DA SILVA,37,NÃO ELEITO
55678,VLADIMIR SANTA MARIA AFONSO JUNIOR,780,SUPLENTE
70110,VLADIMIR MENDES GOMES,43,SUPLENTE
50123,VLADIMIR JUAREZ MELO BATISTA,12,NÃO ELEITO
25225,VIVIANI REIS DA LUZ PAIVA,81,SUPLENTE
65456,VIVIANI MENDES ALVES,0,SUPLENTE
11111,VIVIANI HULLE,32,NÃO ELEITO
45000,VIVIANE ROGERIA PALHETA FERREIRA,168,SUPLENTE
12777,VIVIANE FERREIRA DE SOUZA,18,SUPLENTE
50500,VIVIANE DA COSTA REIS,577,ELEITO POR QP
65655,VIVIANE CONCEIÇÃO PALHETA MONTEIRO,6,NÃO ELEITO
45222,VIVANIO SOBRINHO CIPRIANO,130,SUPLENTE
65444,VIVALDO PEREIRA DA SILVA,18,NÃO ELEITO
22333,VIVALDO MORAIS DA SILVA,119,SUPLENTE
45,VIVALDO MENDES DA CONCEIÇÃO,6306,ELEITO
15222,VIVALDO MARINHO MONTEIRO NUNES JUNIOR,68,SUPLENTE
12500,VIVALDO LOPES DE BARROS,301,SUPLENTE
11678,VIVALDO GONÇALVES DA SILVA,38,SUPLENTE
55000,VITÓRIA DA SILVA SILVA,279,SUPLENTE
51100,VITORIO DOS SANTOS SANTOS,59,NÃO ELEITO
51333,VITORINO MOREIRA DE OLIVEIRA,108,SUPLENTE
40137,VITORINA DO SOCORRO COSTA DA PAIXÃO FURTADO,54,SUPLENTE
25123,VITORIANO MARQUES PAIXÃO,263,NÃO ELEITO
55555,VITORIALDO CARDOSO TEIXEIRA,60,SUPLENTE
55112,VITORIA RAYSSA MACHADO RODRIGUES ARAUJO,5,SUPLENTE
15333,VITORIA QUARESMA MORAES,14,SUPLENTE
77000,VITORIA NICOLI MIRANDA SOUZA,21,SUPLENTE
55020,VITOR WHITNEY SANTOS OLIVA,24,NÃO ELEITO
23001,VITOR SALES CAMINHA,120,SUPLENTE
40567,VITOR LINS SOUSA FARIAS,60,SUPLENTE
70369,VITOR GOMES SOZINHO,172,SUPLENTE
19000,VITOR EDUARDO BARBOSA DE CARVALHO,137,SUPLENTE
20130,VITOR DO NASCIMENTO NETO,47,SUPLENTE
25653,VITOR BRAGA DE OLIVEIRA,5,NÃO ELEITO
70002,VITALINO PEREIRA CARVALHO,104,SUPLENTE
55321,VIRSON FERNANDES SALES,155,SUPLENTE
45666,VIRNA RAQUEL DINIZ DOS SANTOS,99,SUPLENTE
13111,VIRNA ARAUJO DA SILVA,38,NÃO ELEITO
55678,VIRGÍLIO NAZARÉ DA SILVA,56,SUPLENTE
77111,VIRGINIA DO SOCORRO PARENTE BRITO,0,NÃO ELEITO
22000,VINICIUS BARBOSA PEREIRA,326,ELEITO POR MÉDIA
55333,VINICIOS DIEGO MELO PANTOJA,160,SUPLENTE
13123,VINICIO DA SILVA NASCIMENTO,418,SUPLENTE
14888,VILZA DE NAZARE SILVA DE SOUZA,10,NÃO ELEITO
45455,VILTEMBERG MEDEIROS ALVES,126,SUPLENTE
70,VILSON OSNI DA SILVA,1829,NÃO ELEITO
15,VILSON GONÇALVES,3972,ELEITO
19456,VILSON BARBOSA DE SÁ,392,SUPLENTE
15115,VILSON ALVES DOS SANTOS,386,SUPLENTE
19222,VILMAR VIANA LUCENA,39,SUPLENTE
19777,VILMAR PEREIRA DA SILVA,176,SUPLENTE
45777,VILMAR OROZIMBO,6,SUPLENTE
55456,VILMAR NUNES CORREA,179,SUPLENTE
12555,VILMAR NEVES DA SILVA,24,NÃO ELEITO
