Numero_Candidato,Nome_Completo,Votos,Situacao
12444,NILVA APARECIDA FERREIRA DOS SANTOS,66,SUPLENTE
45678,NILTON ZEFERINO MARQUES,594,ELEITO POR QP
45111,NILTON VIEIRA DE ALENCAR,91,SUPLENTE
19555,NILTON VASCONCELOS DE SOUZA,10,SUPLENTE
90666,NILTON SANTOS FREITAS TEIXEIRA,614,ELEITO POR QP
55001,NILTON PEDROSA,122,SUPLENTE
55222,NILTON PAES CARDOSO,1250,ELEITO POR QP
55,NILTON MILITÃO DA ROCHA,3342,NÃO ELEITO
40111,NILTON DO ROSÁRIO TAVARES,17,SUPLENTE
55500,NILTON DIAS COSTA,402,ELEITO POR QP
23456,NILTON CÉSAR FERREIRA ARAÚJO,1060,ELEITO POR QP
65555,NILTON COUTINHO DA COSTA,266,SUPLENTE
28,NILTON CEZAR ALVES DE SOUZA,236,NÃO ELEITO
22580,NILTON CESAR DA SILVA JUNIOR,161,SUPLENTE
23000,NILTON BARBOSA DE LIMA JUNIOR,24,NÃO ELEITO
22238,NILTO JOSE PINHEIRO BARROS,16,SUPLENTE
22111,NILSON VULCAO DA SILVA,21,SUPLENTE
45678,NILSON SARAIVA RIBEIRO,50,SUPLENTE
25111,NILSON SANDRO NOGUEIRA DA SILVA,50,SUPLENTE
19100,NILSON RAIMUNDO PERES LIMA,5,NÃO ELEITO
25261,NILSON NECO DE MORAIS NETO,2,SUPLENTE
22123,NILSON MARTINS SANTA BRIGIDA,386,SUPLENTE
20001,NILSON LUIZ JARDIM DE ALMEIDA,133,SUPLENTE
40747,NILSON FRANCISCO DE LIMA,18,NÃO ELEITO
25232,NILSON FARIAS DOS SANTOS,113,SUPLENTE
10777,NILSON DOS SANTOS VALE,171,SUPLENTE
22123,NILSON DE ARAÚJO RIBEIRO,354,SUPLENTE
10222,NILSON DA SILVA CORREA,27,SUPLENTE
25555,NILSON COSTA LIMA,35,NÃO ELEITO
51444,NILSON CIPRIANO LIMA,96,SUPLENTE
55555,NILSON ANDRADE MIRANDA,92,NÃO ELEITO
90999,NILSON ALVES MARÇAL,256,SUPLENTE
12555,NILSON ALBERONY DOS REIS TAVARES,58,SUPLENTE
20257,NILSINEI SOUZA DA SILVA,146,SUPLENTE
10121,NILSILENE ALVES BRITO DA SILVA,60,SUPLENTE
15000,NILSEN CASTELO DE VASCONCELOS,697,SUPLENTE
40000,NILRYEL SALLES PINTO,225,SUPLENTE
15234,NILO FERREIRA DA COSTA,501,ELEITO POR QP
45450,NILO EMANOEL RENDEIRO DE NORONHA,56,SUPLENTE
15015,NILDON GARCIA DA SILVA,138,SUPLENTE
40121,NILDO VAGNER ALMEIDA DO NASCIMENTO,4,SUPLENTE
25765,NILDO NAZARENO BARBOSA RODRIGUES,718,NÃO ELEITO
90,NILDO MÁRCIO DE ARAÚJO AQUINO,278,NÃO ELEITO
40444,NILDO MELO DA SILVA,86,SUPLENTE
13555,NILDE SILVA DE SOUZA,18,SUPLENTE
22135,NILDA MARIA SOARES,113,SUPLENTE
55123,NILDA MARIA PAULA NUNES,71,SUPLENTE
11125,NILDA MACIEL DO NASCIMENTO,20,NÃO ELEITO
20300,NILCIRENE TAVARES DE OLIVEIRA,145,SUPLENTE
22222,NILCIRENE RODRIGUES TEIXEIRA,164,SUPLENTE
65432,NILCICLEIDE AMORIM DA SILVA,6,SUPLENTE
10500,NILCICLEIA ALVES CAETANO,21,NÃO ELEITO
20015,NILCE TEIXEIRA PINTO,1,NÃO ELEITO
10010,NILCE SULLIVAN NUNES FERREIRA,19,SUPLENTE
19456,NIL GOMES ARAUJO,199,SUPLENTE
77000,NIERCIO RAMOS BASTOS,234,SUPLENTE
25700,NIEGE MENDES RODRIGUES,22,SUPLENTE
15111,NICOLAU FRANCISCO DE ASSUNÇÃO,350,SUPLENTE
15,NICOLAU EURÍPEDES BELTRÃO PAMPLONA,1962,ELEITO
25429,NICIA CARINA DE SOUZA BATISTA,31,SUPLENTE
25040,NICELIA PEREIRA DE SOUZA,14,NÃO ELEITO
45622,NICELENA RUFFEIL DA SILVA,1403,ELEITO POR QP
55500,NIARIS NOGUEIRA FERREIRA,606,SUPLENTE
15777,NGONHTE KAYAPO,129,SUPLENTE
19444,NEZILDO ALVES FEITOSA,6,NÃO ELEITO
65520,NEZILDA SALES DE SOUSA,0,NÃO ELEITO
36234,NEYLA NAIANE DE CASTRO NUNES,23,NÃO ELEITO
40999,NEY LEANDRO SANTOS DA SILVA,65,SUPLENTE
13222,NEY GONÇALVES DE ARAÚJO,115,SUPLENTE
90000,NEY GILBERTO PENA PANTOJA,872,ELEITO POR QP
14180,NEWTON CELESTINO DE JESUS,19,NÃO ELEITO
19555,NEVITON LUIZ DA SILVA COSTA,103,SUPLENTE
51015,NEUZINHA ALVES FERREIRA,13,SUPLENTE
13,NEUZILA DE MATOS PEREIRA,2811,NÃO ELEITO
55222,NEUZI VENANCIO DA SILVA,33,SUPLENTE
55777,NEUZENI MAGALHAES MATA GRANDE,70,NÃO ELEITO
25555,NEUZARINA LOPES PINTO,32,SUPLENTE
36345,NEUZA PINHEIRO DOS REIS,5,NÃO ELEITO
40999,NEUZA OLÍVIA DOS SANTOS MENDES,129,SUPLENTE
10111,NEUZA MARIA SERRÃO MORAES,18,NÃO ELEITO
20777,NEUZA MARIA DOS SANTOS,30,SUPLENTE
15444,NEUZA DO SOCORRO SILVA SARAIVA,41,SUPLENTE
33444,NEUZA DA SILVA GOMES,54,SUPLENTE
70077,NEUZA AMELIA BRAGA SALES,3,SUPLENTE
20005,NEUVANY PATROCINIO DE LIMA MACIEL,2,SUPLENTE
19999,NEUSILENE DE SOUSA COSTA,512,SUPLENTE
14782,NEUSA MARIA FONSECA DA SILVA,59,SUPLENTE
20222,NEUSA MACHADO DA SILVA,65,SUPLENTE
15,NEUSA CORREA MARTINS,3651,NÃO ELEITO
51789,NEUSA BERNADETH PINTO DE SOUSA,105,NÃO ELEITO
43122,NEURIANE DA SILVA MELO,84,NÃO ELEITO
13122,NEUREAN LEITE DO ESPÍRITO SANTO,37,NÃO ELEITO
45123,NEUMAR XAVIER DE OLIVEIRA,315,ELEITO POR QP
45121,NEUMA DA CONCEICAO DE OLIVEIRA,1,NÃO ELEITO
13133,NEUDILAN DE SOUSA BEZERRA,104,NÃO ELEITO
12345,NESTOR MONTEIRO DA PAIXÃO FILHO,232,ELEITO POR MÉDIA
55543,NESTOR COSTA DA CRUZ,142,ELEITO POR QP
20111,NESTOR AMADEU MATOS DA SILVA,104,SUPLENTE
25192,NERIVALDO DE SOUZA RIBEIRO,74,SUPLENTE
12345,NERIVAL DA SILVA CORREA,372,NÃO ELEITO
77111,NERIS DOS ANJOS ALMEIDA,314,SUPLENTE
55000,NERIANA PANTOJA DOS SANTOS,16,SUPLENTE
22123,NERESVALDO BASTOS NASCIMENTO,158,SUPLENTE
40444,NEOLINDA DA SILVA PINHO,17,NÃO ELEITO
77555,NENROD DANTAS ARCHAR SILVA NETO,17,NÃO ELEITO
19112,NELY NOGUEIRA SAMPAIO,16,SUPLENTE
13123,NELY ALMERINDA CHAVES MATOS DA SILVA,17,SUPLENTE
43000,NELTON LIMA DA SILVA,30,SUPLENTE
65555,NELSON TRINDADE DOS SANTOS,13,NÃO ELEITO
15000,NELSON SOARES SANTANA,183,SUPLENTE
20020,NELSON RODRIGUES BEZERRA,423,SUPLENTE
20020,NELSON RENATO RODRIGUES DE ARAÚJO,130,NÃO ELEITO
15707,NELSON POMPEU RIBEIRO DA CONCEIÇÃO,56,SUPLENTE
15,NELSON PINHEIRO DA SILVA,6480,NÃO ELEITO
55038,NELSON PACIFICO DE OLIVEIRA,597,SUPLENTE
55222,NELSON NOBRE DE LIMA,273,SUPLENTE
20085,NELSON MOTTA SOARES,208,SUPLENTE
11,NELSON LUIZ ZANELLATO,550,NÃO ELEITO
55048,NELSON LOPES DOS SANTOS,12,NÃO ELEITO
25123,NELSON LISBOA DA SILVA,327,ELEITO POR MÉDIA
50111,NELSON LIMA ROSA,50,SUPLENTE
20240,NELSON FETISCH,183,SUPLENTE
11111,NELSON FERREIRA DE SOUZA FILHO,48,SUPLENTE
25666,NELSON FERREIRA DE SOUZA,52,SUPLENTE
55666,NELSON DE SOUZA CUSTODIO,16,SUPLENTE
15444,NELSON DA SILVA,97,SUPLENTE
90231,NELSON COSME OLIVEIRA REIS,32,SUPLENTE
14789,NELSON CAMPOS RIBEIRO,77,NÃO ELEITO
90150,NELSON ANTONIO OLIVEIRA DE JESUS FILHO,257,SUPLENTE
77111,NELSON ADRIANO MEZZOMO,428,ELEITO POR QP
22000,NELSINDA FORSTER,250,SUPLENTE
15678,NELMA RIBEIRO DA SILVA MACIEL,407,SUPLENTE
22233,NELMA MOTA DA SILVA,39,SUPLENTE
15777,NELMA LIANE PEREIRA DE GOES,75,SUPLENTE
12345,NELMA DE OLIVEIRA VIEIRA,390,ELEITO POR MÉDIA
40444,NELMA DE FÁTIMA PONTES FRANCO,0,NÃO ELEITO
11345,NELMA DE CASSIA NASCIMENTO DA COSTA,102,SUPLENTE
51985,NELMA COSTA LIMA,2,NÃO ELEITO
20999,NELMA CORREA CARVALHO,0,NÃO ELEITO
20,NELIO NAZARENO AMORIM DA SILVA,4347,NÃO ELEITO
15615,NELIA SILVA DE OLIVEIRA SANTOS,40,SUPLENTE
11172,NELIA DE NAZARE TAVARES DA SILVA,12,SUPLENTE
12789,NELIA CRISTINA DE SOUZA OLIVEIRA,39,SUPLENTE
20222,NELI RAMOS DA SILVA,14,SUPLENTE
20333,NELI GABRIEL MENEZES,78,SUPLENTE
23333,NELI BORGARO,80,NÃO ELEITO
55007,NELDSON ELIAS DE SOUSA,818,ELEITO POR QP
10127,NELCIVALDO JOSE GOES,25,NÃO ELEITO
10777,NELCINO LOPES DE OLIVEIRA,385,ELEITO POR QP
13133,NELCI PEREIRA DE CARVALHO,35,NÃO ELEITO
10700,NEIZA FONTES DE SOUZA,38,SUPLENTE
15123,NEIVALDO RIBEIRO DOS SANTOS,182,ELEITO POR MÉDIA
13033,NEIVA REJANE AMARAL DA COSTA,40,NÃO ELEITO
10041,NEIVA DOS SANTOS COSTA,10,NÃO ELEITO
51999,NEIVA BORGES FARIAS,30,SUPLENTE
77678,NEILSON DA LUZ MONTEIRO,8,SUPLENTE
12444,NEILIANA DA COSTA OLIVEIRA,19,SUPLENTE
55678,NEILA MARIA DAS MERCÊS PEREIRA,479,ELEITO POR QP
45014,NEILA DINÁ MONTEIRO BRITO,157,SUPLENTE
10900,NEILA CRISTINA SILVA DAS NEVES,22,SUPLENTE
43442,NEIF PEREIRA PERNA,10,NÃO ELEITO
12065,NEIDIANE DA COSTA OLIVEIRA,28,SUPLENTE
13633,NEIDE SILVA ROSA,2,NÃO ELEITO
11999,NEIDE MARIA FERREIRA DE SALES,17,SUPLENTE
65456,NEIDE MACÊDO DE MOURA MELO,195,SUPLENTE
15555,NEIDE IUSSF JABOUR,101,SUPLENTE
22111,NEIDE APARECIDA DE SOUZA BEZERRA,153,SUPLENTE
10300,NEIDA ALVES DE PAULA,14,NÃO ELEITO
15456,NEI SANTIAGO DIAS MORAES,8,SUPLENTE
20222,NEI JOSÉ PIMENTEL RAMOS,162,SUPLENTE
14122,NEI CRISTIANO CORREIA DA SILVA,116,NÃO ELEITO
45222,NEI ALMEIDA RAMOS,153,SUPLENTE
45626,NEHEMIAS GUEDES VALENTIM,940,SUPLENTE
10000,NEDYMA COSTA LIMA,321,SUPLENTE
45345,NEDINO SOUZA AMARAL FILHO,46,SUPLENTE
22789,NAZILMA DA CONCEIÇÃO NUNES RODRIGUES,6,SUPLENTE
25125,NAZILDO MELO PANTOJA,117,NÃO ELEITO
28700,NAZIANA RODRIGUES CONCEIÇÃO DOS SANTOS,2,NÃO ELEITO
23121,NAZARÉ PINHEIRO MONTEIRO,11,NÃO ELEITO
50032,NAZARÉ INÊZ RODRIGUES DA SILVA,57,NÃO ELEITO
45045,NAZARÉ DO SOCORRO PEREIRA SOARES,4,SUPLENTE
13400,NAZARINO ALVES DA SILVA,157,SUPLENTE
15555,NAZARENO VINHOTE DE FARIAS,270,SUPLENTE
25000,NAZARENO TRINDADE DE CRISTO,403,SUPLENTE
90100,NAZARENO SILVA ARRUDA,31,SUPLENTE
20888,NAZARENO SAMPAIO CORREA,0,NÃO ELEITO
13113,NAZARENO RICHEL DA SILVA MARQUES,8,NÃO ELEITO
40999,NAZARENO PINHEIRO DE QUEIROZ,45,NÃO ELEITO
90333,NAZARENO PEREIRA DE MATOS,33,NÃO ELEITO
19333,NAZARENO OLIVEIRA DOS SANTOS,94,SUPLENTE
10345,NAZARENO NASCIMENTO DA SILVA,23,NÃO ELEITO
55100,NAZARENO DOS SANTOS TRINDADE,21,NÃO ELEITO
77707,NAZARENO DO SOCORRO MORAES MIRANDA,6,SUPLENTE
22580,NAZARENO DE LIMA DIAS,375,ELEITO POR QP
20444,NAZARENO DE JESUS RIBEIRO LOBATO,4,SUPLENTE
10222,NAZARENO DA SILVA SALES,100,SUPLENTE
13456,NAZARENO DA SILVA E SOUZA,369,ELEITO POR QP
15258,NAZARENO CUNHA E CUNHA,276,SUPLENTE
13321,NAZARENO ALMEIDA DA SILVA,62,SUPLENTE
23623,NAZARENA LEIDIANE LOPES RAMOS,32,NÃO ELEITO
20005,NAZARE SIMONE RODRIGUES ARAUJO,1,SUPLENTE
23999,NAZARE LOBATO PORTILHO,36,SUPLENTE
15555,NAZARE DO SOCORRO RAMOS GOMES,42,SUPLENTE
13113,NAZARE DO SOCORRO CAVALCANTE MIRANDA,166,SUPLENTE
55000,NAZARE DE JESUS COSTA,7,SUPLENTE
15444,NAZARE DE FATIMA DANTAS DE ARAUJO,206,SUPLENTE
19444,NAZARE CASTRO SILVA,23,SUPLENTE
13700,NAZARE CARDOSO FEIJAO,28,NÃO ELEITO
18128,NAYNE MELEM DOS SANTOS,42,NÃO ELEITO
55888,NAYARA SILVA DOS REIS,31,SUPLENTE
22000,NAYARA OEIRAS PINHEIRO FAVACHO,622,ELEITO POR QP
22011,NAYARA ISA DOS SANTOS PADILHA,21,NÃO ELEITO
40321,NAYARA FERREIRA LIMA,45,SUPLENTE
25125,NAYARA AGUIAR DE ABREU,5,SUPLENTE
22777,NAYANE MARTINS DE MORAES,7,NÃO ELEITO
22300,NAYANE DUTRA DE SOUZA,13,SUPLENTE
15235,NAYANE DA SILVA SANTOS,238,SUPLENTE
90001,NAYANE CARVALHO CANTÃO,2,SUPLENTE
13321,NAURO LUIS PEREIRA CHAVES,7,SUPLENTE
45001,NAUN JOSE GAMA ABREU,48,SUPLENTE
45444,NAUM JOHN DOS SANTOS ALMEIDA,3,SUPLENTE
13555,NAUM FERREIRA DA SILVA,81,NÃO ELEITO
14007,NAUDIR ROSA CARDOSO,99,SUPLENTE
23777,NAUDIR MODESTO DE ASSIS,242,SUPLENTE
27777,NAUDIR DA PONTE DE SOUZA,277,ELEITO POR MÉDIA
15123,NATÁLIA DE MATOS SILVA,85,SUPLENTE
19019,NATUREZA DA SILVA SERRAO,11,NÃO ELEITO
28456,NATIANE RIBEIRO SOUSA,1,NÃO ELEITO
45,NATHÁLIA FERREIRA D OLIVEIRA,5579,NÃO ELEITO
14500,NATHASSIA MAYNARA MARQUES BELO,46,NÃO ELEITO
70222,NATHANEL KENNEDY DA SILVA OSORIO,69,NÃO ELEITO
25125,NATHALY ROCHA DE SOUSA,34,SUPLENTE
45333,NATARY SANTANA VAZ,18,SUPLENTE
45222,NATANEL CARVALHO FREITAS,6,SUPLENTE
22777,NATANAEL SOUZA TEIXEIRA,73,SUPLENTE
22245,NATANAEL SERRÃO MARINHO,48,SUPLENTE
28138,NATANAEL RODRIGUES DA SILVA,19,NÃO ELEITO
36116,NATANAEL PINHEIRO LOPES,10,SUPLENTE
65246,NATANAEL PANTOJA CUIMAR,52,SUPLENTE
40000,NATANAEL MENDES DOURADO VIANA,48,NÃO ELEITO
45457,NATANAEL LOBATO MONTEIRO,4,SUPLENTE
20230,NATANAEL FARIAS PEREIRA,12,SUPLENTE
12771,NATANAEL DOS SANTOS FEITOSA,206,NÃO ELEITO
15234,NATANAEL DOS SANTOS ANDRADE,7,NÃO ELEITO
20200,NATANAEL DO NASCIMENTO BEZERRA,55,NÃO ELEITO
19555,NATANAEL DA CUNHA PAIXÃO,168,SUPLENTE
12645,NATANAEL CUIMAR DE ALMEIDA,16,NÃO ELEITO
19011,NATANAEL AMORIM CUNHA,18,NÃO ELEITO
19999,NATAN PORTILHO GOMES,200,SUPLENTE
15157,NATAN PALHETA BRITO,46,SUPLENTE
22345,NATAN LINHARES DE ARAÚJO,0,SUPLENTE
12,NATAN JOSE DINIZ TULIO,738,NÃO ELEITO
20999,NATALINO SOARES DE LIMA,383,ELEITO POR MÉDIA
22333,NATALINO OLIVEIRA DA SILVA,165,SUPLENTE
22123,NATALINO MONTEIRO BRASIL,32,SUPLENTE
13800,NATALINO DOS SANTOS BANDEIRA,36,NÃO ELEITO
15300,NATALINA DE JESUS DE OLIVEIRA PANTOJA,44,SUPLENTE
51470,NATALINA BARCELOS,29,SUPLENTE
17280,NATALICIA DA SILVA NEBRA,0,SUPLENTE
17935,NATALIA RODRIGUES DE JESUS,0,NÃO ELEITO
28179,NATALIA PINHO FERREIRA DA SILVA,1,NÃO ELEITO
70227,NATALIA PEDROSA DE ALMEIDA,0,NÃO ELEITO
20999,NATALIA MARIA MATOS DO AMARAL,69,NÃO ELEITO
51110,NATALIA DE NAZARÉ SOARES MENDONÇA,12,NÃO ELEITO
22229,NATALIA DE JESUS SILVA DOS SANTOS,251,SUPLENTE
40442,NATALIA DE JESUS CARVALHO DA SILVA,1,SUPLENTE
35220,NATALIA DA SILVA GOMES,1,NÃO ELEITO
13131,NATALENE DE SOUSA MARINHO,14,SUPLENTE
90333,NATAL DE JESUS DE FREITAS CALDAS,170,NÃO ELEITO
14202,NASINHA DE SOUSA,6,SUPLENTE
77234,NARIELE REIS DE BRITO,4,SUPLENTE
55113,NARCIZO BARBOSA PANTOJA,40,SUPLENTE
23623,NARCISO PACHECO ASSUNÇÃO NETO,106,NÃO ELEITO
45255,NARCISA DE MELO SANTOS,30,SUPLENTE
40888,NARCILEA CARNEIRO FERREIRA,141,SUPLENTE
40456,NARACY PINHEIRO GAMA,205,SUPLENTE
12125,NARA SIMONE DOS REIS FURTADO,11,SUPLENTE
43234,NARA NUBIA SILVA SANTOS,2,NÃO ELEITO
12321,NARA HELOISE DOS SANTOS SILVA,70,SUPLENTE
77145,NARA HELENA DA MATA RODRIGUES,19,NÃO ELEITO
65999,NARA CINTIA LOPES DA SILVA,17,SUPLENTE
45055,NAMARA SOLANGE LISBOA DE ALMEIDA,3,SUPLENTE
22345,NALVAIDES SILVEIRA AMARAL,24,SUPLENTE
55200,NALDO MARTINS LOPES,209,SUPLENTE
65111,NALDO FIUZA LEAL,55,SUPLENTE
43023,NALDILENE BATISTA DA SILVA,44,NÃO ELEITO
11567,NAJARA REGINA SANTOS DE SOUSA,32,SUPLENTE
22666,NAIVAN FERRAZ DA SILVA,10,SUPLENTE
45101,NAIUZA FERRAZ DOS SANTOS,5,SUPLENTE
45444,NAISSON GUIMARAES DA SILVA FILHO,150,SUPLENTE
65050,NAIRO BENTES DE MELO,7,SUPLENTE
15111,NAIRO BARROSO VIDAL,577,ELEITO POR QP
12155,NAIRA FELIPE ARAGÃO,28,NÃO ELEITO
22200,NAIRA DA CONCEIÇÃO DA SILVA CARDOSO,42,SUPLENTE
11114,NAIR TEREZA DA SILVA BOTELHO,16,SUPLENTE
13567,NAIR PAULINO DA SILVA LEMES,400,SUPLENTE
15113,NAIR DE SOUSA SANTOS,63,SUPLENTE
45456,NAILZA NASCIMENTO DE MIRANDA,506,SUPLENTE
51222,NAILSON SOARES CARDOSO,42,NÃO ELEITO
33456,NAILSON DINIZ DOS SANTOS,131,SUPLENTE
11112,NAILSON ALVES DE OLIVEIRA,155,SUPLENTE
22223,NAILMA SILVA,347,ELEITO POR MÉDIA
55645,NAILDO ROCHA E SILVA,89,SUPLENTE
14777,NAIFE GILBERTO DE SOUZA FUZIEL,261,SUPLENTE
20111,NAIDE CARVALHO NASCIMENTO,117,SUPLENTE
13001,NAIARA RAIOL TORRES,107,NÃO ELEITO
55125,NAIARA EDULÂNIA BRAGA DA SILVA,49,SUPLENTE
20000,NAIANE RAMOS DA SILVA,43,SUPLENTE
13111,NAIANE MEDEIROS DA SILVA,374,SUPLENTE
40191,NAHUM FERNANDES DA SILVA,11,SUPLENTE
55222,NAHOR DE SOUSA VIEIRA,102,SUPLENTE
20777,NAHILTON SOUSA DE OLIVEIRA,62,SUPLENTE
25777,NAGILA RUTH AGUIAR SANTOS,23,SUPLENTE
55555,NAGIB SANDRO JAQUES DE SOUZA,54,NÃO ELEITO
19019,NAFTTALI DE SOUSA LIMA,274,ELEITO POR QP
70770,NADSON CALDEIRA DA SILVA PIMENTEL,96,SUPLENTE
13456,NADIR FONSECA DAMASCENO,15,NÃO ELEITO
15234,NADIR CAETANO DA SILVA,218,SUPLENTE
90150,NADILSON CARVALHO ALENCAR,48,NÃO ELEITO
15100,NADIEL GOMES DE LIMA,21,SUPLENTE
11000,NADIEL ASSUNÇÃO LEAL,34,NÃO ELEITO
12222,NADIA NYALLA DOS SANTOS BRAGA,698,SUPLENTE
40333,NADIA MYLENE DUARTE BARROSO,44,SUPLENTE
15678,MÔNICA MIRANDA SOARES SANTANA,758,ELEITO POR QP
15015,MÔNICA DOS SANTOS COELHO,274,SUPLENTE
13123,MÔNICA DE ALMEIDA,56,SUPLENTE
55118,MÔNICA CARVALHO GONÇALVES,11,SUPLENTE
10912,MÔNICA ATAÍDE DO ESPÍRITO SANTO,0,SUPLENTE
43043,MÍRIA MELO SANTOS,30,SUPLENTE
50555,MÁRIO RODRIGUES DA SILVA FILHO,68,SUPLENTE
20800,MÁRIO ITIYA VIEIRA KOBAYASHI,498,ELEITO POR MÉDIA
40777,MÁRIO FELIX DE SOUZA,41,SUPLENTE
35100,MÁRCIO TRINDADE MENDES,19,NÃO ELEITO
17222,MÁRCIO SANTOS COSTA,118,NÃO ELEITO
15789,MÁRCIO OLIVEIRA DA SILVA,663,ELEITO POR QP
15000,MÁRCIO NOGUEIRA LOPES,1456,ELEITO POR QP
55022,MÁRCIO LIMA DOS SANTOS,66,NÃO ELEITO
20789,MÁRCIO HOLANDA,140,SUPLENTE
15000,MÁRCIO GERALDO BORGES DE SOUSA,498,ELEITO POR QP
22000,MÁRCIO DIAS BICALHO,92,SUPLENTE
20130,MÁRCIO DE CASTRO MARTINS,1143,ELEITO POR QP
22444,MÁRCIO CORREA DO ROSÁRIO,61,SUPLENTE
19123,MÁRCIO ARAÚJO DOS ANJOS,29,NÃO ELEITO
77678,MÁRCIA VIEIRA DE ASSIS,0,NÃO ELEITO
50777,MÁRCIA VIEIRA DA SILVA,168,SUPLENTE
36005,MÁRCIA REIS DE SOUSA,101,SUPLENTE
55134,MÁRCIA REGINA DA SILVA NOVAES,0,NÃO ELEITO
12333,MÁRCIA PEREIRA DE JESUS,29,SUPLENTE
12171,MÁRCIA PATRICIA MEDEIROS FERREIRA,1,SUPLENTE
23333,MÁRCIA OLIVEIRA ARRUDA,34,SUPLENTE
20321,MÁRCIA JACKLINE DA COSTA SILVA,6,NÃO ELEITO
45112,MÁRCIA HELENA FERREIRA MACIEL,51,SUPLENTE
22022,MÁRCIA GABRIELA SILVA DE JESUS,13,SUPLENTE
15,MÁRCIA FERREIRA LOPES,6555,ELEITO
77,MÁRCIA ELIZIANE NASCIMENTO FREITAS,61,NÃO ELEITO
14200,MÁRCIA DO ROSÁRIO BRITO,0,SUPLENTE
20317,MÁRCIA CRISTINA DE SOUZA PINTO,50,SUPLENTE
10210,MÁRCIA CARVALHO ANDRADE DA PAIXÃO,69,SUPLENTE
14115,MÁRCIA ALVES RODRIGUES,94,NÃO ELEITO
55,MYLENE COSTA DA SILVEIRA,7257,NÃO ELEITO
90655,MYCNAMARA MORAES DA SILVA RIBEIRO,219,SUPLENTE
10120,MURILO ÂNGELO VIDAL DO VALE,46,SUPLENTE
15111,MURILO THIAGO QUEIROZ BARBOSA,83,SUPLENTE
14111,MURILO MELO FERREIRA,79,SUPLENTE
65989,MURILO LIMA RIBEIRO,37,NÃO ELEITO
13442,MURILO LIMA DE FIGUEIREDO,2,NÃO ELEITO
20100,MURILO JOSÉ TOLENTINO DE MATOS,552,ELEITO POR QP
70777,MURILO DA SILVA MACHADO JURUNA,30,NÃO ELEITO
33777,MURILO ALDO DA SILVA CRUZ,683,ELEITO POR MÉDIA
22777,MURILLO BRACALI BARROS FERREIRA,242,SUPLENTE
20123,MUNIZ ERBA CAMPOS,75,SUPLENTE
10500,MUCIO LEÃO DE LUCENA SOUZA,126,SUPLENTE
51222,MOZER MARTINS LIMA,401,NÃO ELEITO
55456,MOZAIR PEREIRA DA SILVA,120,SUPLENTE
20190,MONZANIEL SOARES DE MIRANDA,33,SUPLENTE
13013,MONIQUE NOBREGA DE ÁVILA,55,NÃO ELEITO
15100,MONIQUE MELO TODDE DE OLIVEIRA,166,SUPLENTE
14000,MONICA VALERIA PININCHO RODRIGUES DOS SANTOS,10,SUPLENTE
55111,MONICA SILVA DOS SANTOS,236,SUPLENTE
22567,MONICA SANTIAGO,17,SUPLENTE
10567,MONICA OLIVEIRA MENDES,51,SUPLENTE
45777,MONICA MARIA LIMA DE CARVALHO,121,SUPLENTE
15345,MONICA MARGARETE DOS SANTOS ARAUJO,1,SUPLENTE
43013,MONICA DOS SANTOS PIMENTA,5,SUPLENTE
17899,MONICA DO SOCORRO ROCHA DO NASCIMENTO,8,NÃO ELEITO
13130,MONICA DO SOCORRO ALVES DO NASCIMENTO,10,NÃO ELEITO
12100,MONICA DE ALMEIDA VASCONCELOS,59,SUPLENTE
12321,MONICA DAS GRAÇAS DAS DORES NOGUEIRA,111,SUPLENTE
13234,MONICA BATISTA DA FONSECA,67,NÃO ELEITO
13789,MOISÉS SILVA PAIXÃO,583,ELEITO POR MÉDIA
10010,MOISÉS PEREIRA MACIEL,31,NÃO ELEITO
17217,MOISÉS MOTA COELHO,34,SUPLENTE
10109,MOISÉS DE SOUSA E SOUSA,71,SUPLENTE
77222,MOISÉS DE ALBUQUERQUE MIRANDA,22,SUPLENTE
19233,MOISÉS COÊLHO MAGALHÃES,245,SUPLENTE
45678,MOISES VIANA COSTA,316,SUPLENTE
15000,MOISES TACK,204,SUPLENTE
13999,MOISES RUFINO BERNARDO DE MORAES,35,NÃO ELEITO
22190,MOISES RODRIGUES DIAS,118,NÃO ELEITO
40111,MOISES RODRIGUES COSTA,332,SUPLENTE
10370,MOISES OLIVEIRA DA CONCEICAO,7,SUPLENTE
40040,MOISES OLIVEIRA BRITO,138,NÃO ELEITO
65658,MOISES MARTINS DE PAIVA,7,SUPLENTE
19888,MOISES JÚNIOR DANTAS DE SOUZA,28,SUPLENTE
12400,MOISES FERREIRA DA SILVA,0,SUPLENTE
20333,MOISES DOS SANTOS OLIVEIRA,104,SUPLENTE
15254,MOISES DO CARMO MAGALHAES,92,SUPLENTE
22888,MOISES DE LIMA FERREIRA,348,ELEITO POR QP
14410,MOISES DE JESUS SILVA,267,SUPLENTE
77789,MOISES DA SILVA OLIVEIRA,342,SUPLENTE
15333,MOISES DA SILVA LIMA,771,ELEITO POR QP
23777,MOISES CASTRO RODRIGUES,76,NÃO ELEITO
12789,MOISES CASTRO MARQUES,101,SUPLENTE
55010,MOISES CARVALHO DA SILVA,50,SUPLENTE
15600,MOISES BELICIO DOS SANTOS,159,SUPLENTE
14789,MOISES BATISTA SALES,203,SUPLENTE
13603,MOISES BARRA DE OLIVEIRA,625,SUPLENTE
19120,MOISES ALVES DE OLIVEIRA,29,NÃO ELEITO
13155,MOISES ALVES DA SILVA,186,NÃO ELEITO
19123,MOISANIEL PEREIRA DE LIMA,114,SUPLENTE
20200,MOACY MARINHO DA SILVA,98,SUPLENTE
20155,MOACY GONCALVES DE SOUSA,28,SUPLENTE
55258,MOACIRA ALMEIDA ALHO,625,ELEITO POR QP
22,MOACIR PIRES DE FARIA,10404,ELEITO
45012,MOACIR PEREIRA DOS SANTOS FILHO,26,SUPLENTE
19888,MOACIR OLIVEIRA DA SILVA,12,SUPLENTE
45199,MOACIR IRAN NASCIMENTO MORAES FILHO,1194,ELEITO POR QP
77199,MOACIR IRAN NASCIMENTO MORAES,0,SUPLENTE
11444,MOACIR FERREIRA,9,NÃO ELEITO
11123,MOACIR DOS SANTOS SILVA,22,NÃO ELEITO
55666,MOACIR DA COSTA,234,SUPLENTE
20345,MOACIR DA CONCEIÇÃO,79,SUPLENTE
55111,MOACELIO PEREIRA MELO,220,ELEITO POR MÉDIA
12456,MOABE DIAS DO NASCIMENTO,121,SUPLENTE
20,MOAB BORGES LIMA,232,NÃO ELEITO
15,MIZUHO SASAKI OHAZE,974,NÃO ELEITO
12456,MIZIALVA COSTA DOS SANTOS,64,SUPLENTE
70321,MIZELIAS CHERMONT GONÇALVES,39,SUPLENTE
20100,MIZAEL PEREIRA DA FONSECA,98,SUPLENTE
43999,MIZAEL MONTEIRO LIMA,22,NÃO ELEITO
12406,MIZAEL MELO PALHETA,0,NÃO ELEITO
65123,MIZAEL MACIEL SOUZA,184,NÃO ELEITO
22345,MIZAEL DA SILVA PERNA,64,NÃO ELEITO
11789,MIZAEL BELTRÃO BRAGANÇA,52,NÃO ELEITO
90888,MIVALDO MONTEIRO DE MELO,37,SUPLENTE
20333,MIVALDO DOS SANTOS CARNEIRO,85,SUPLENTE
22456,MISRAEL DE SOUSA DOS SANTOS,488,ELEITO POR QP
12180,MISAEL DA CRUZ MARQUES,11,NÃO ELEITO
90145,MISAEL DA COSTA LIMA,132,NÃO ELEITO
65999,MISAEL BRICIO TELES,188,SUPLENTE
27444,MISAEL ALVES DOS SANTOS,6,NÃO ELEITO
20250,MIRTES MARIA DA SILVA ALEXANDRIA,23,SUPLENTE
22555,MIRTES CRISTINA DA SILVA RIBEIRO,46,NÃO ELEITO
12125,MIRTES CLEIDE MAGALHAES DE LIMA FERREIRA,63,SUPLENTE
15666,MIROZALVA NAHUM DE SENA,31,SUPLENTE
77111,MIRONEIDE NUNES PESSOA,51,SUPLENTE
25555,MIRNA CIRTE ZAPELLON,428,ELEITO POR MÉDIA
22522,MIRLEN HEVILY DA COSTA PENA,65,SUPLENTE
55444,MIRISVAL GONÇALVES ALVES,146,SUPLENTE
90700,MIRIAN SILVA DA SILVA DE OLIVEIRA,2,SUPLENTE
25025,MIRIAN SANTOS FERREIRA,217,SUPLENTE
90123,MIRIAN SANTOS DE FREITAS PASTANA,2,SUPLENTE
45455,MIRIAN PANTOJA RODRIGUES,12,SUPLENTE
40777,MIRIAN GOMES DA SILVA,67,SUPLENTE
22123,MIRIAN FERREIRA DOS SANTOS,113,SUPLENTE
43005,MIRIAN DE PAULA BARBOSA AMADOR,0,NÃO ELEITO
51222,MIRIAN CORREIA SOARES,253,SUPLENTE
23,MIRIAN BRITO PINHEIRO,1733,NÃO ELEITO
14126,MIRIAN ARAUJO DA SILVA,30,NÃO ELEITO
51555,MIRIAM RODRIGUES VIRGINIO,15,NÃO ELEITO
20111,MIRIAM PINHEIRO DE OLIVEIRA,60,SUPLENTE
12444,MIRIAM PEREIRA AMORIM,64,SUPLENTE
40999,MIRIAM DE SOUZA COSTA,42,SUPLENTE
25666,MIRIAM DA SILVA COELHO,20,SUPLENTE
51426,MIRIAM DA SILVA BARBOSA,1,SUPLENTE
13333,MIRAILSON PANTOJA DOS SANTOS,72,NÃO ELEITO
45111,MIRACY DOS REIS ROCHA,495,ELEITO POR QP
20234,MIRACELIA GOMES DA SILVA,28,NÃO ELEITO
28777,MIQUELE SOUZA MOURA,1,NÃO ELEITO
22777,MIQUEL BATISTA DA SILVA JUNIOR,57,SUPLENTE
13130,MIQUEIAS JOVIANO DOS SANTOS LIMA,395,ELEITO POR MÉDIA
20654,MIQUEIAS DE MATOS ALVES,146,SUPLENTE
20777,MIQUEIAS DA CUNHA FREITAS,31,SUPLENTE
55,MINERVINA MARIA DE BARROS SILVA,7753,NÃO ELEITO
40222,MINEIR BENTO DE OLIVEIRA JUNIOR,24,SUPLENTE
45555,MILTON VINICIUS AMORIM DE OLIVEIRA,156,NÃO ELEITO
20333,MILTON VILHENA DE MOURA,117,SUPLENTE
13113,MILTON SANTO DE BRITO PENA,209,SUPLENTE
55147,MILTON REIS MARTINS,222,SUPLENTE
25222,MILTON NUNES DA COSTA,475,ELEITO POR MÉDIA
13166,MILTON NILO PELOSO DA SILVA,94,SUPLENTE
55234,MILTON NASCIMENTO TAVARES,97,SUPLENTE
70000,MILTON MOREIRA FERNANDES,242,SUPLENTE
23114,MILTON MORAIS,17,NÃO ELEITO
40610,MILTON MACHADO RODRIGUES,23,SUPLENTE
20999,MILTON LUIZ MOREIRA GOES,16,SUPLENTE
36199,MILTON LUIZ DE OLIVEIRA SOBRINHO,28,NÃO ELEITO
25444,MILTON DA SILVA TRINDADE,146,SUPLENTE
20123,MILTON CEZAR CHAGAS DAS NEVES,6,NÃO ELEITO
77007,MILTON CARLOS SANTOS BARROS,42,SUPLENTE
55555,MILTON BRUNO LIMA LOBÃO,624,SUPLENTE
12456,MILSON CHARLES TUMA DOS REIS,40,SUPLENTE
50424,MILKERLLANDIA OLIVEIRA GOMES,28,NÃO ELEITO
10456,MILKA DE SOUSA MORAES,15,SUPLENTE
10000,MILENY SANTOS MULLER,81,NÃO ELEITO
15333,MILENILSON DA SILVA FREITAS,439,ELEITO POR QP
55000,MILENILDO DA SILVA FREITAS,411,SUPLENTE
40555,MILENILDA CORRÊA ROCHA,38,SUPLENTE
13569,MILENE RISUENHO LAUANDE,221,SUPLENTE
23456,MILENE DE SEIXAS MARTINS CABRAL,45,NÃO ELEITO
23123,MILENE CRUZ DOS SANTOS,17,NÃO ELEITO
90777,MILENE CARDOSO DE PAULA APOLINÁRIO,90,SUPLENTE
22777,MILENE BERGAMIN HESPANHOL,65,SUPLENTE
25222,MILENE AMARAL TELES,23,SUPLENTE
51888,MILENE ALICE FEIO DOS ANJOS,9,NÃO ELEITO
65000,MILENA DA SILVA CARVALHO,30,SUPLENTE
55555,MILENA DA COSTA LUSTOSA MACHADO,767,ELEITO POR QP
51000,MILEIDE MARQUES SILVA DE ALMEIDA,104,SUPLENTE
55333,MIKHAIL DA SILVA CARVALHO,210,SUPLENTE
28134,MIKELLE  CUNHA DE SANTANA,3,NÃO ELEITO
19678,MIKAELA RAUANNY CARVALHO AVELAR,368,ELEITO POR QP
20777,MIGUELITA MARIA VASQUES RIBEIRO FURTADO,499,ELEITO POR QP
15120,MIGUEL VIEIRA DA SILVA,44,SUPLENTE
55333,MIGUEL TEIXEIRA DE MORAES,184,SUPLENTE
14339,MIGUEL SELVINO DOS SANTOS,16,NÃO ELEITO
13333,MIGUEL SANTOS NASCIMENTO,67,NÃO ELEITO
25888,MIGUEL RODRIGUES MARQUES,386,ELEITO POR MÉDIA
23,MIGUEL RIBEIRO BAIA,554,NÃO ELEITO
10999,MIGUEL PORTELA DA SILVA JUNIOR,4,NÃO ELEITO
14111,MIGUEL PEREIRA DE SOUZA JUNIOR,66,SUPLENTE
15450,MIGUEL OLIVEIRA VIANA JUNIOR,93,SUPLENTE
50180,MIGUEL NETO RODRIGUES CARIPUNA,105,SUPLENTE
55226,MIGUEL NERES MONTEIRO,57,NÃO ELEITO
22333,MIGUEL MIRANDA DE OLIVEIRA,125,SUPLENTE
25,MIGUEL MARQUES MACHADO,4094,NÃO ELEITO
43222,MIGUEL MARQUES,25,SUPLENTE
65000,MIGUEL LOPES DA SILVA,17,NÃO ELEITO
15000,MIGUEL LOBATO MALHEIROS,804,ELEITO POR QP
90888,MIGUEL LOBATO DOS SANTOS FILHO,65,SUPLENTE
14155,MIGUEL LINDOLFO MAGNO SOUSA,139,NÃO ELEITO
25222,MIGUEL LIMA DO CARMO,93,SUPLENTE
25123,MIGUEL IVONALDO FARIAS BARRETO,715,ELEITO POR QP
77500,MIGUEL HOSANA BARBOSA BRANDÃO,18,SUPLENTE
51819,MIGUEL HENRIQUE SILVA DA SILVA,71,NÃO ELEITO
15111,MIGUEL FORTE BARBOSA,131,SUPLENTE
19789,MIGUEL FIGUEIRA BRASIL,5,NÃO ELEITO
20731,MIGUEL FERREIRA DOS SANTOS,14,SUPLENTE
11888,MIGUEL DOS SANTOS COSTA,26,NÃO ELEITO
45123,MIGUEL DO SOCORRO PUREZA PIMENTEL,579,ELEITO POR QP
12010,MIGUEL DO CARMO ARAUJO,0,SUPLENTE
20456,MIGUEL DE LIMA PINHEIRO,35,NÃO ELEITO
12999,MIGUEL DE JESUS TEIXEIRA,48,SUPLENTE
19555,MIGUEL DE JESUS PANTOJA RODRIGUES,169,ELEITO POR MÉDIA
10345,MIGUEL DANTAS MATIAS,126,NÃO ELEITO
55800,MIGUEL DA SILVA BANDEIRA,24,SUPLENTE
13640,MIGUEL CUNHA FILHO,10,SUPLENTE
25233,MIGUEL COELHO DE CARVALHO,23,SUPLENTE
36333,MIGUEL CLEICIVALDO LOPES DA SILVA,8,NÃO ELEITO
40888,MIGUEL CAVALCANTE DOS SANTOS FILHO,484,ELEITO POR QP
13013,MIGUEL BEZERRA SOARES,24,NÃO ELEITO
15,MIGUEL BERNARDO DA COSTA JUNIOR,7322,ELEITO
40456,MIGUEL AUGUSTO DE OLIVEIRA TEIXEIRA,90,SUPLENTE
40190,MIGUEL ANTONILSON LOBATO REÇA,6,SUPLENTE
12777,MIGUEL ANGELO SILVA,9,SUPLENTE
55123,MIGUEL ANGELO PINHEIRO DE SOUZA,388,SUPLENTE
23234,MIGUEL ANGELO CAVALCANTE VIEIRA,49,SUPLENTE
90444,MIGUEL ALVES BARROS,909,ELEITO POR QP
