Numero_Candidato,Nome_Completo,Votos,Situacao
55333,JOSÉ MARIA MENEZES DOS SANTOS,70,SUPLENTE
10678,JOSÉ MARIA MARTINS FELGUEIRA,125,NÃO ELEITO
19444,JOSÉ MARIA MACHADO MARQUES,88,SUPLENTE
40222,JOSÉ MARIA LOPES DA SILVA,36,NÃO ELEITO
40010,JOSÉ MARIA LIMA OLIVEIRA,8,NÃO ELEITO
22345,JOSÉ MARIA JUNIOR PEREIRA TAPAJOS,1433,ELEITO POR QP
55000,JOSÉ MARIA GONÇALVES DOS SANTOS,358,ELEITO POR MÉDIA
13678,JOSÉ MARIA FERREIRA DE OLIVEIRA,55,SUPLENTE
17,JOSÉ MARIA DOS SANTOS GOMES,2548,NÃO ELEITO
13444,JOSÉ MARIA DOS SANTOS FARIAS,527,ELEITO POR QP
77555,JOSÉ MARIA DOS REIS,21,NÃO ELEITO
15210,JOSÉ MARIA DIAS ASSIS,83,SUPLENTE
13131,JOSÉ MARIA DE SOUSA TEIXEIRA,242,SUPLENTE
36567,JOSÉ MARIA DE MENDONÇA,5,NÃO ELEITO
70123,JOSÉ MARIA DE LIMA SEGUNDO,1500,ELEITO POR MÉDIA
12011,JOSÉ MARIA DE LIMA PACHECO,33,SUPLENTE
15900,JOSÉ MARIA DE LIMA COSTA,99,SUPLENTE
28333,JOSÉ MARIA DE ARAÚJO MORAES JÚNIOR,206,SUPLENTE
51555,JOSÉ MARIA DE ARAÚJO LOBATO,37,SUPLENTE
15333,JOSÉ MARIA DAMASCENO DE LIRA,205,SUPLENTE
45789,JOSÉ MARIA DA SILVA RODRIGUES,756,SUPLENTE
15999,JOSÉ MARIA DA SILVA MATOS,102,SUPLENTE
40456,JOSÉ MARIA COSTA DA SILVA,387,SUPLENTE
22225,JOSÉ MARIA CASTRO DOS SANTOS,27,NÃO ELEITO
25255,JOSÉ MARIA CARNEIRO SOUZA,271,SUPLENTE
40279,JOSÉ MARIA CABRAL DE MORAES,12,NÃO ELEITO
22345,JOSÉ MARIA BRAGA DOS SANTOS,449,SUPLENTE
23555,JOSÉ MARIA BORGES DE OLIVEIRA,93,NÃO ELEITO
33444,JOSÉ MARCOS DA LUZ SILVA,110,SUPLENTE
15045,JOSÉ MARCONE DUARTE DA SILVA,10,NÃO ELEITO
10111,JOSÉ MARCIO MACHADO DE ALMEIDA,4,NÃO ELEITO
70600,JOSÉ MARCELO FERREIRA DE LIMA,10,NÃO ELEITO
20456,JOSÉ MAIA DE OLIVEIRA,61,NÃO ELEITO
11611,JOSÉ MAGALHAES FORTES,3,NÃO ELEITO
12666,JOSÉ MACIEL DUARTE,10,NÃO ELEITO
40111,JOSÉ LUIZ MOREIRA DA SILVA,223,SUPLENTE
15000,JOSÉ LUIZ MONTEIRO LOPES,85,SUPLENTE
15000,JOSÉ LUIZ GONÇALVES DE MELO,185,SUPLENTE
23246,JOSÉ LUIZ DOS SANTOS FIGUEIREDO,46,NÃO ELEITO
90123,JOSÉ LUIZ DA SILVA SANTOS,33,NÃO ELEITO
55455,JOSÉ LUIS SOUZA DE SOUZA,80,NÃO ELEITO
22231,JOSÉ LUIS RODRIGUES DA CONCEIÇÃO,20,NÃO ELEITO
11345,JOSÉ LUIS FERREIRA TELES,117,NÃO ELEITO
45999,JOSÉ LUIS DA SILVA NETO,156,SUPLENTE
15010,JOSÉ LOPES MASCARENHA,373,ELEITO POR QP
15151,JOSÉ LIMA VIEIRA,226,SUPLENTE
51444,JOSÉ LIJACKSON DE OLIVEIRA BORGES,9,NÃO ELEITO
23303,JOSÉ LEVY DE LIMA CARDOSO,5,SUPLENTE
36200,JOSÉ LEUDO MAIA FILHO,7,NÃO ELEITO
50456,JOSÉ LEONARDO DOS SANTOS REIS,106,NÃO ELEITO
14100,JOSÉ LENILDO DA SILVA OLIVEIRA,156,SUPLENTE
13113,JOSÉ JOSINEIS OLIVEIRA DOS SANTOS,225,SUPLENTE
15999,JOSÉ JOCY BARROS ARAUJO,45,SUPLENTE
20020,JOSÉ JARDEL QUADRA DA SILVA,80,NÃO ELEITO
65065,JOSÉ JAIR ALVES COSTA,18,NÃO ELEITO
13,JOSÉ IVALDO MARTINS GUIMARÃES,5045,NÃO ELEITO
22123,JOSÉ ILSON LIRA DE AGUIAR,659,ELEITO POR QP
22999,JOSÉ ILSON DE MELO TELES,2311,ELEITO POR QP
23000,JOSÉ HUDSON SOARES DE ARAÚJO,33,NÃO ELEITO
45234,JOSÉ HIPÓLITO FERREIRA ALMEIDA,74,SUPLENTE
10333,JOSÉ HILTON ROCHA DE SOUZA JUNIOR,304,SUPLENTE
23223,JOSÉ HERALDO SILVA SOUZA,232,SUPLENTE
10777,JOSÉ HENRIQUE PANTOJA DE MORAES,26,SUPLENTE
13182,JOSÉ HENRIQUE DE JESUS PINTO,13,SUPLENTE
55666,JOSÉ HAROLDO LEITE DA SILVA DE BRITO,94,SUPLENTE
25123,JOSÉ GONÇALVES DA CRUZ,350,SUPLENTE
13211,JOSÉ GOMES FERNANDES,1,NÃO ELEITO
13333,JOSÉ GLEYBSON ALVES NETO,317,SUPLENTE
25888,JOSÉ GLEISON DA SILVA CONCEIÇÃO,275,ELEITO POR MÉDIA
19456,JOSÉ GENIVAL FERREIRA DOS SANTOS,139,SUPLENTE
36300,JOSÉ GEDEÃO MONTEIRO CARDOSO,20,NÃO ELEITO
12345,JOSÉ FÉLIX BARBOSA,78,SUPLENTE
65655,JOSÉ FÁBIO DA COSTA CARVALHO,61,SUPLENTE
40567,JOSÉ FRANCISCO DANTAS NOGUEIRA,0,NÃO ELEITO
25733,JOSÉ FRANCINALDO DOS SANTOS SILVA,48,SUPLENTE
20066,JOSÉ FLAVIO DE OLIVEIRA GERMANI,3,SUPLENTE
20456,JOSÉ FLAVIO DA SILVA,96,SUPLENTE
20111,JOSÉ FILHO FREIRES PEREIRA,5,NÃO ELEITO
25666,JOSÉ FILHO ALVES PEREIRA,84,SUPLENTE
70555,JOSÉ FERREIRA LIMA,43,NÃO ELEITO
19019,JOSÉ FERREIRA DOS SANTOS,1214,ELEITO POR QP
12345,JOSÉ FERREIRA DA COSTA,1530,ELEITO POR QP
22645,JOSÉ FERRARI,180,ELEITO POR QP
70999,JOSÉ FERNANDO LIMA CARDOSO,45,NÃO ELEITO
14111,JOSÉ EWERTON BRITO DAS NEVES,87,NÃO ELEITO
55111,JOSÉ EVERALDO FERREIRA MENEZES,169,SUPLENTE
40111,JOSÉ EVANDRO BARROS ANDRÉ JÚNIOR,51,NÃO ELEITO
23111,JOSÉ EUDES SARAIVA DE SOUZA,159,SUPLENTE
40000,JOSÉ ERIVERTON MAGALHÃES NUNES,496,SUPLENTE
45111,JOSÉ ERINALDO GUIMARAES MORAES,103,SUPLENTE
22007,JOSÉ EMERSON RODRIGUES BENTES,8,SUPLENTE
11123,JOSÉ EMERSON CAMPOS SAMPAIO,223,ELEITO POR MÉDIA
40118,JOSÉ ELIMAR ALVES RUFINO,65,NÃO ELEITO
25566,JOSÉ ELIEMA GOMES,39,SUPLENTE
50555,JOSÉ ELENILSON SILVA DE SOUSA,30,NÃO ELEITO
15500,JOSÉ ELBEM CRUZ FARIAS,271,SUPLENTE
12333,JOSÉ EDUARDO DE OLIVA BELO,170,SUPLENTE
40400,JOSÉ EDUARDO DE CARVALHO,56,SUPLENTE
25800,JOSÉ EDSON FONTES DO CARMO,133,SUPLENTE
13654,JOSÉ EDIVALDO MARQUES VALES,87,SUPLENTE
11111,JOSÉ EDIBERTO DIAS PANTOJA,739,ELEITO POR MÉDIA
40111,JOSÉ DÁRIO OLIVEIRA SOUZA,426,NÃO ELEITO
20678,JOSÉ DOUGLAS SARGES BELÉM,26,SUPLENTE
13555,JOSÉ DOS SANTOS GONÇALVES,239,SUPLENTE
22111,JOSÉ DOS SANTOS DE MORAES,574,SUPLENTE
15500,JOSÉ DOS REIS TELES BATISTA,71,SUPLENTE
19999,JOSÉ DOS REIS SILVA FILHO,286,SUPLENTE
11608,JOSÉ DOMINGOS DE RAMOS VIANA FRANCO,64,SUPLENTE
15333,JOSÉ DOMINGOS DE NAZARÉ CONCEIÇÃO,28,SUPLENTE
10010,JOSÉ DOMINGOS ALMEIDA,16,SUPLENTE
77000,JOSÉ DO CARMO OLIVEIRA GUIMARÃES,41,SUPLENTE
25111,JOSÉ DIONIZIO DO NASCIMENTO JÚNIOR,441,ELEITO POR MÉDIA
65432,JOSÉ DE SOUZA GONÇALVES,274,SUPLENTE
22045,JOSÉ DE SOUZA BEZERRA,467,SUPLENTE
14687,JOSÉ DE SOUSA XIMENES,211,SUPLENTE
10444,JOSÉ DE SOUSA NOJOSA,586,NÃO ELEITO
20,JOSÉ DE SENA GOMES,2343,NÃO ELEITO
65789,JOSÉ DE RIBAMAR DA SILVA ARAÚJO,171,NÃO ELEITO
14777,JOSÉ DE RIBAMAR CUNHA MENDONÇA,47,SUPLENTE
45789,JOSÉ DE RIBAMAR COSTA SOUZA,160,SUPLENTE
10888,JOSÉ DE RIBAMAR BORGES DO NASCIMENTO,76,SUPLENTE
15789,JOSÉ DE QUEIROZ MOREIRA,409,SUPLENTE
15345,JOSÉ DE JESUS DE SOUZA,70,SUPLENTE
70277,JOSÉ DE JESUS CALDAS LIMA,3,SUPLENTE
36222,JOSÉ DE JESUS,39,NÃO ELEITO
36,JOSÉ DE CARVALHO RENTE,440,NÃO ELEITO
28777,JOSÉ DE BRITO,14,NÃO ELEITO
13510,JOSÉ DE ASSUNÇÃO DIAS,79,SUPLENTE
12012,JOSÉ DE ASSIS LUZ DE ARAÚJO,192,SUPLENTE
25789,JOSÉ DE ARIMATÉIA PEREIRA NASCIMENTO,10,SUPLENTE
14000,JOSÉ DE ARIMATÉIA MARQUES DE SOUSA,272,NÃO ELEITO
77567,JOSÉ DAS GRAÇAS RODRIGUES BELÉM,32,NÃO ELEITO
55678,JOSÉ DA SILVA SANTOS,182,SUPLENTE
45555,JOSÉ DA SILVA DE OLIVEIRA,137,SUPLENTE
40888,JOSÉ CÍCERO SENA FARIAS,178,SUPLENTE
90111,JOSÉ CÉLIO MINEIRO BORGES,19,SUPLENTE
28444,JOSÉ CUPERTINO MONTEIRO DO NASCIMENTO JUNIOR,3,NÃO ELEITO
12111,JOSÉ COSMO CORREA DA SILVA,75,SUPLENTE
36000,JOSÉ CORREA DA SILVA,131,NÃO ELEITO
25789,JOSÉ CONCEIÇÃO DOS REIS FARIAS,251,SUPLENTE
14123,JOSÉ CONCEIÇÃO DA CRUZ RAMOS,85,SUPLENTE
23233,JOSÉ COELHO DE CARVALHO FILHO,786,ELEITO POR QP
20123,JOSÉ CLÁUDIO MIRANDA,548,SUPLENTE
22221,JOSÉ CLOUDOALDO MORAES DA SILVA,516,SUPLENTE
50333,JOSÉ CLEYTON PAIXÃO DE OLIVEIRA,153,NÃO ELEITO
13222,JOSÉ CLEO MOREIRA DOS SANTOS,101,SUPLENTE
23123,JOSÉ CLEITON DE SOUZA SIQUEIRA,168,SUPLENTE
51234,JOSÉ CLEIDES PEREIRA,123,SUPLENTE
22444,JOSÉ CLEBIO DA SILVA FERREIRA,259,SUPLENTE
16,JOSÉ CLEBER BARROS RABELO,169,NÃO ELEITO
23125,JOSÉ CIRINO DO NASCIMENTO,86,SUPLENTE
45145,JOSÉ CEZAR SANTOS,1,SUPLENTE
40000,JOSÉ CARNECI PINHEIRO FILHO,135,SUPLENTE
45678,JOSÉ CARLOS SILVA DE SOUZA,530,SUPLENTE
50444,JOSÉ CARLOS RODRIGUES,13,NÃO ELEITO
40285,JOSÉ CARLOS OLIVEIRA GEMAQUE,21,SUPLENTE
22321,JOSÉ CARLOS MONTEIRO DE AMORIM,11,SUPLENTE
10123,JOSÉ CARLOS MARIA VALENTE,1045,ELEITO POR QP
11111,JOSÉ CARLOS LIMA LOPES,37,SUPLENTE
51222,JOSÉ CARLOS FERNANDES DE QUEIROZ,17,NÃO ELEITO
55100,JOSÉ CARLOS DO NASCIMENTO SOARES,56,SUPLENTE
55141,JOSÉ CARLOS DIAS DE SOUSA,0,SUPLENTE
13222,JOSÉ CARLOS DE ARAUJO CABRAL,109,SUPLENTE
55555,JOSÉ CARLOS DA SILVA MARTINS,285,SUPLENTE
28777,JOSÉ CARLOS DA SILVA FERREIRA,58,NÃO ELEITO
28017,JOSÉ CARLOS DA SILVA,16,NÃO ELEITO
70016,JOSÉ CARLOS CRUZ MENEZES,72,SUPLENTE
13147,JOSÉ CARLOS CARDOSO,8,SUPLENTE
14222,JOSÉ CARLOS BAIA LEONEL,78,NÃO ELEITO
22000,JOSÉ CARLOS ALMEIDA DE SOUZA,91,SUPLENTE
14,JOSÉ BRAULIO DA COSTA,6933,ELEITO
40555,JOSÉ BRAGA DA SILVA,141,NÃO ELEITO
55111,JOSÉ BONIFACIO VIANA BARROSO,1217,ELEITO POR QP
15222,JOSÉ BONIFACIO DO VALE FIGUEIREDO,41,SUPLENTE
65124,JOSÉ BENTES DE LIMA,3,NÃO ELEITO
15,JOSÉ BENITO PRIANTE JUNIOR,19866,NÃO ELEITO
13000,JOSÉ BENEDITO GONÇALVES FERNANDES,400,SUPLENTE
19333,JOSÉ BARROS DA SILVA FILHO,4,NÃO ELEITO
15611,JOSÉ BARREIRA BORGES,269,SUPLENTE
55755,JOSÉ AUGUSTO SOARES DE JESUS,83,NÃO ELEITO
70222,JOSÉ AUGUSTO LOPES DOS SANTOS,15,NÃO ELEITO
14333,JOSÉ AUGUSTO LIMA DA ROCHA,32,SUPLENTE
25017,JOSÉ AUGUSTO DOS SANTOS,43,NÃO ELEITO
15,JOSÉ AUGUSTO DIAS DA SILVA,4048,ELEITO
10999,JOSÉ AUGUSTO DE SOUZA OLIVEIRA,51,SUPLENTE
13674,JOSÉ AUGUSTO DA SILVA SANTOS,21,NÃO ELEITO
10555,JOSÉ AUGUSTO CARVALHO DA SILVA,451,SUPLENTE
23555,JOSÉ AUGUSTO BRITO MESQUITA,48,SUPLENTE
90123,JOSÉ AUGUSTO BORGES DA COSTA,448,SUPLENTE
43001,JOSÉ AROLDO MORAES OSORIO,39,SUPLENTE
20777,JOSÉ ARNALDO TRINDADE NUNES,18,NÃO ELEITO
10010,JOSÉ ARNALDO CRUZ,85,SUPLENTE
19123,JOSÉ ARMANDO MEDRADO RODRIGUES,262,NÃO ELEITO
13115,JOSÉ ARLINDO CORREA DE MELO E SILVA,168,NÃO ELEITO
40111,JOSÉ ARLEDO MARQUES DE SOUZA,284,ELEITO POR QP
20950,JOSÉ ARIMATEIA FERREIRA,26,SUPLENTE
20220,JOSÉ ARAÚJO DA SILVA,68,SUPLENTE
15611,JOSÉ APARECIDO COSTA SOARES,268,SUPLENTE
55000,JOSÉ ANTÔNIO RODRIGUES DA SILVA,59,SUPLENTE
10110,JOSÉ ANTONIO RODRIGUES DE SOUZA,49,NÃO ELEITO
55222,JOSÉ ANTONIO QUARESMA MIRANDA,336,SUPLENTE
70,JOSÉ ANTONIO PINHO ALHO JÚNIOR,33,NÃO ELEITO
13333,JOSÉ ANTONIO PEREIRA DE SOUZA,292,SUPLENTE
45130,JOSÉ ANTONIO MONTEIRO Ó DE ALMEIDA,102,SUPLENTE
13620,JOSÉ ANTONIO MARTINS DE SOUZA,229,SUPLENTE
43100,JOSÉ ANTONIO LIMONGE VALENTE,6,NÃO ELEITO
22888,JOSÉ ANTONIO DA SILVA AMARO,12,NÃO ELEITO
23077,JOSÉ ANTONIO BRITO,52,SUPLENTE
15,JOSÉ ANTONIO AZEVEDO LEÃO,19220,ELEITO
70956,JOSÉ ANTONIO ALMEIDA DA SILVA,77,SUPLENTE
19771,JOSÉ ANILSON SOUSA CONCEIÇÃO,3,NÃO ELEITO
90345,JOSÉ ANDRÉ SILVA SOUZA,22,SUPLENTE
77132,JOSÉ ANDRÉ RAMOS PANTOJA,46,SUPLENTE
13333,JOSÉ ANDERSON BARRETO DE FREITAS,193,SUPLENTE
65000,JOSÉ AMÉRICO BARROS MACIEL,14,SUPLENTE
13513,JOSÉ AMORIM MONTEIRO,186,SUPLENTE
12000,JOSÉ AMIRALDO LOPES DE JESUS,203,SUPLENTE
55567,JOSÉ AMILTON DIAS PASTANA,11,SUPLENTE
51013,JOSÉ ALVES PEREIRA,10,NÃO ELEITO
22111,JOSÉ ALVES FEITOSA,240,SUPLENTE
22888,JOSÉ ALVES DE LIMA,444,SUPLENTE
10133,JOSÉ ALVES DE CARVALHO,13,SUPLENTE
19011,JOSÉ ALVARO GUIMARAES DA SILVA,88,SUPLENTE
45455,JOSÉ ALUIZIO RODRIGUES DA TRINDADE,219,SUPLENTE
22222,JOSÉ ALMIR MARTINS COSTA,27,NÃO ELEITO
17123,JOSÉ ALMIR COSTA SILVA,60,SUPLENTE
12112,JOSÉ ALEXANDRE SOARES,438,SUPLENTE
45555,JOSÉ ALEXANDRE GAMA CORREA,46,SUPLENTE
22125,JOSÉ ALBERTO PEDROSA DE OLIVEIRA,196,SUPLENTE
50000,JOSÉ ALBERTO GOMES ABREU,15,NÃO ELEITO
50,JOSÉ ALACID DA SILVA,946,NÃO ELEITO
20234,JOSÉ AILTON DA SILVA,591,ELEITO POR QP
22000,JOSÉ AFONSO SILVA SARGES ROCHA,907,SUPLENTE
23123,JOSÉ AFONSO GOMES DA IGREJA,167,SUPLENTE
14222,JOSÉ ADIEL XAVIER DE QUEIROZ,515,SUPLENTE
45013,JOSÉ ADELINO PEGO DOS SANTOS,158,SUPLENTE
10555,JOSUÉ SOUSA LEITE,36,SUPLENTE
20567,JOSUÉ SILVA DA SILVA,264,SUPLENTE
27123,JOSUÉ RAMOS DE SANTA BRÍGIDA,193,SUPLENTE
70700,JOSUÉ OLIVEIRA MARTINS,335,SUPLENTE
22007,JOSUÉ GUIMARAES DE OLIVEIRA,126,SUPLENTE
19555,JOSUÉ DO NASCIMENTO MIRANDA,0,NÃO ELEITO
22444,JOSUÉ DA SILVA OLIVEIRA,449,SUPLENTE
40123,JOSUÉ DA CONSOLAÇÃO SILVA,74,NÃO ELEITO
11000,JOSUÉ BATISTA PRESTES,32,SUPLENTE
12234,JOSUÉ BARROS DOS SANTOS,141,SUPLENTE
15789,JOSUÉ AVELAR MOREIRA,0,SUPLENTE
55551,JOSUILA DE SOUSA LIMA,47,SUPLENTE
14111,JOSUELIDO DO NASCIMENTO ALBUQUERQUE SOUSA,326,SUPLENTE
22234,JOSUE ZEFERINO DAS CHAGAS,84,SUPLENTE
36666,JOSUE SILVA DA CONCEIÇÃO,2,NÃO ELEITO
15015,JOSUE SERRAO CANTAO,266,SUPLENTE
45444,JOSUE PEREIRA RODRIGUES,36,SUPLENTE
10163,JOSUE NOGUEIRA FILHO,103,SUPLENTE
15100,JOSUE MORAIS LACERDA,307,ELEITO POR QP
13413,JOSUE MONTEIRO ARRAES,7,NÃO ELEITO
90300,JOSUE MACIEL DA CONCEIÇÃO,29,SUPLENTE
77778,JOSUE MACHADO BARROS,69,SUPLENTE
25222,JOSUE JESUS DE ARAUJO,170,SUPLENTE
20230,JOSUE FERREIRA CAVALCANTE,89,SUPLENTE
20000,JOSUE EVANGELISTA FERREIRA,32,SUPLENTE
10190,JOSUE DOS SANTOS VASCONCELOS,23,SUPLENTE
51234,JOSUE DOS SANTOS FERREIRA,236,NÃO ELEITO
40900,JOSUE DE ALMEIDA MANGABEIRA,101,SUPLENTE
22345,JOSUE DAMÁSIO RODRIGUES,116,SUPLENTE
12345,JOSUE BARBOSA SILVA,5,NÃO ELEITO
45999,JOSUE AGUIAR DE SOUSA,322,SUPLENTE
22122,JOSTER BARROSO SANTOS,431,SUPLENTE
33222,JOSIVANE DOS SANTOS TRINDADE,22,SUPLENTE
51456,JOSIVAN SILVA COSTA,234,NÃO ELEITO
14777,JOSIVAN RIBEIRO VIEIRA,60,NÃO ELEITO
40444,JOSIVAN FRANCISCO DA SILVA,95,NÃO ELEITO
20200,JOSIVAN DE SOUSA BRANDÃO,55,SUPLENTE
45000,JOSIVAN DA SILVA,300,SUPLENTE
18555,JOSIVAM PEREIRA DA SILVA,168,SUPLENTE
40123,JOSIVALDO SANTOS DA SILVA,161,SUPLENTE
10026,JOSIVALDO RIBEIRO MOREIRA,239,ELEITO POR MÉDIA
10444,JOSIVALDO PINHEIRO PANTOJA,578,SUPLENTE
40333,JOSIVALDO NEGRÃO DE ALENCAR,58,SUPLENTE
14321,JOSIVALDO DOS SANTOS SILVA,747,SUPLENTE
43543,JOSIVALDO DA SILVA TEIXEIRA,27,SUPLENTE
22345,JOSIVALDO DA CONCEIÇÃO,35,SUPLENTE
20333,JOSIVALDO COSTA DA SILVA,23,NÃO ELEITO
15222,JOSIVALDO COSTA ARAGÃO,23,SUPLENTE
35,JOSINO DE SOUSA DOS REIS,26,NÃO ELEITO
11,JOSINO ALVES DA COSTA,7363,NÃO ELEITO
36555,JOSINEY GOMES PORTAL,52,NÃO ELEITO
55444,JOSINELMA CARVALHO DOS SANTOS,1,SUPLENTE
11011,JOSINEI MORAES DE CASTRO,235,SUPLENTE
28111,JOSINEI DOS SANTOS LOPES,35,NÃO ELEITO
70555,JOSINEI DA SILVA LIMA,175,SUPLENTE
22100,JOSINEI DA SILVA IPIRANGA,315,SUPLENTE
20333,JOSINEI DA CRUZ PINHEIRO,73,SUPLENTE
20555,JOSINALDO LIMA BARROSO,11,NÃO ELEITO
17333,JOSINALDO GOMES RODRIGUES,317,SUPLENTE
55333,JOSIMO MARQUES NUNES,107,SUPLENTE
50500,JOSIMO BARBOSA DE ALMEIDA,22,NÃO ELEITO
55111,JOSIMEIRE RODRIGUES FEITOSA,88,SUPLENTE
15333,JOSIMARA VIEIRA TAVARES,2,SUPLENTE
51888,JOSIMAR TOMAZ LIMA,704,ELEITO POR QP
17333,JOSIMAR TOLINTINO FERREIRA,97,SUPLENTE
43444,JOSIMAR SACRAMENTO LOPES,30,NÃO ELEITO
23333,JOSIMAR ORLANDO MARTINS,307,SUPLENTE
36,JOSIMAR MESSIAS DE SOUSA,96,NÃO ELEITO
13333,JOSIMAR GONÇALVES NASCIMENTO,90,SUPLENTE
15630,JOSIMAR GONÇALVES DE OLIVEIRA,306,ELEITO POR QP
10135,JOSIMAR DE FREITAS SILVA,179,SUPLENTE
20007,JOSIMAR DE AMARAL FREITAS,30,SUPLENTE
14001,JOSIMAR CARDOSO SANTANA,302,SUPLENTE
55,JOSIMAR ALVES MATA GRANDE,127,NÃO ELEITO
12012,JOSIMAR ALVES DOS SANTOS,6,NÃO ELEITO
19190,JOSILENE SOUZA GARCIA,2,NÃO ELEITO
13642,JOSILENE NUNES DA SILVA,20,SUPLENTE
13192,JOSILENE LÚCIA DOS SANTOS,5,SUPLENTE
23777,JOSILENE ESPÍNDOLA DE BRITO,60,SUPLENTE
14500,JOSILENE DUQUE DOS SANTOS,8,SUPLENTE
55511,JOSILENE DE SOUZA SANTOS,12,SUPLENTE
22111,JOSILENE DA ASSUNÇÃO MIRANDA,16,SUPLENTE
25000,JOSILENE ASSIS COSTA,11,NÃO ELEITO
45615,JOSILEIDE SILVA MONTEIRO,25,SUPLENTE
19297,JOSILEIA LIMA DOS SANTOS,23,NÃO ELEITO
20500,JOSILEI ADRIANO FREITAS DE OLIVEIRA,36,SUPLENTE
27000,JOSILDO RIBEIRO BRASIL,176,SUPLENTE
15147,JOSILDO BISPO DOS SANTOS,162,SUPLENTE
55000,JOSIENE EVANGELISTA BENMUYAL,56,SUPLENTE
13456,JOSIENE BRASIL PINTO SOUTO,78,SUPLENTE
36100,JOSIELI DA SILVA BARBOSA,5,NÃO ELEITO
12300,JOSIELE VIEIRA CASTRO,22,SUPLENTE
90789,JOSIELE DIAS FUGAÇA ALVES,28,SUPLENTE
20212,JOSIELE DE SOUSA DAMASCENO,10,NÃO ELEITO
55345,JOSIELE BARROSO COSTA,43,SUPLENTE
55123,JOSIEL RAMOS DA SILVA,43,SUPLENTE
70707,JOSIEL PEREIRA LIMA,27,SUPLENTE
22333,JOSIEL PANTOJA DE SOUZA,440,ELEITO POR QP
20000,JOSIEL MELO SOUSA DO NASCIMENTO,192,SUPLENTE
70999,JOSIEL GOMES DA COSTA,42,SUPLENTE
70111,JOSIEL DE OLIVEIRA BARBOSA,329,ELEITO POR QP
20165,JOSIEL DE JESUS ARAUJO MACIEL,779,ELEITO POR QP
23333,JOSIEL DA SILVA DE MELO,121,NÃO ELEITO
40000,JOSIEL COSTA DA SILVA,114,NÃO ELEITO
15123,JOSIEL CABRAL DE SOUZA,103,SUPLENTE
14777,JOSICLEISON DO NASCIMENTO SILVA,247,SUPLENTE
28403,JOSICLEIA PANTOJA COELHO,3,NÃO ELEITO
55163,JOSICLEIA GONÇALVES MOURA,29,NÃO ELEITO
51789,JOSICLEIA BATISTA MAGALHAES,0,NÃO ELEITO
45555,JOSICLEI SOUZA NASCIMENTO,27,SUPLENTE
10111,JOSIAS VERAS DE MORAIS,36,SUPLENTE
25024,JOSIAS SOARES DE SOUSA,63,SUPLENTE
25222,JOSIAS SILVA RIBEIRO,110,SUPLENTE
11123,JOSIAS SEABRA PORTAL,67,NÃO ELEITO
15126,JOSIAS REIS DE SOUZA,72,SUPLENTE
22822,JOSIAS NAZARENO PINHEIRO BAIA,3,SUPLENTE
51567,JOSIAS LISBOA FIGUEIREDO,0,NÃO ELEITO
27888,JOSIAS GUEDES DE OLIVEIRA,15,SUPLENTE
55777,JOSIAS DOS SANTOS BELO,492,SUPLENTE
12125,JOSIAS DOS REIS MOREIRA,0,NÃO ELEITO
20777,JOSIAS DA SILVA NEVES JUNIOR,261,SUPLENTE
51234,JOSIAS DA SILVA HIGINO,42,ELEITO POR MÉDIA
45123,JOSIAS CASTRO ALMEIDA,52,SUPLENTE
22789,JOSIAS CARDOSO DO NASCIMENTO,508,SUPLENTE
19666,JOSIANI SILVA DOS ANJOS,59,SUPLENTE
25888,JOSIANE VIEIRA DOS SANTOS,37,SUPLENTE
55125,JOSIANE SOARES DA SILVA,17,SUPLENTE
50,JOSIANE SILVA RODRIGUES,345,NÃO ELEITO
19456,JOSIANE GONÇALVES MELO,97,SUPLENTE
17800,JOSIANE GOMES DA CRUZ,120,SUPLENTE
25444,JOSIANE DE SOUZA BRASIL,20,SUPLENTE
40004,JOSIANE DE FATIMA GAIA PARA,57,SUPLENTE
45156,JOSIANE DA COSTA BAIA,679,SUPLENTE
50777,JOSIANE COSTA,44,NÃO ELEITO
25255,JOSIANE CASTRO FONSECA,10,SUPLENTE
90007,JOSIANE CARDOSO BOTELHO,6,SUPLENTE
51432,JOSIANE BARBOSA FRAZÃO,0,NÃO ELEITO
13500,JOSIANE  ARAÚJO DE FREITAS,611,NÃO ELEITO
45000,JOSIANA DE SOUZA FERNANDES,314,ELEITO POR QP
22555,JOSIANA DA SILVA DEMBINSKI,34,SUPLENTE
50444,JOSIANA DA CONCEIÇÃO DA COSTA RODRIGUES,11,SUPLENTE
13111,JOSEVAL DE AZEVEDO,13,NÃO ELEITO
70787,JOSENIR SANCHES AMARAL,22,SUPLENTE
55222,JOSENILTON GARCIA MACHADO,838,SUPLENTE
25000,JOSENILSON OLIVEIRA DA SILVA,151,SUPLENTE
13123,JOSENILDO RODRIGUES DE VILHENA,1381,SUPLENTE
77888,JOSENILDO DE OLIVEIRA FIGUEIRA,297,SUPLENTE
19012,JOSENILDO DA CONCEIÇÃO PEREIRA,220,SUPLENTE
19666,JOSENILDE DOS SANTOS MORAIS,12,NÃO ELEITO
14015,JOSENILDA DA SILVA E SILVA,8,NÃO ELEITO
28888,JOSENIL JUNIOR PACHECO BITENCOURT,415,NÃO ELEITO
12122,JOSENI DOS ANJOS LEAL,36,SUPLENTE
22202,JOSENALDO LUNA DE CASTRO,133,SUPLENTE
55123,JOSEMIR DA SILVA LIMA,381,ELEITO POR QP
22122,JOSELY PINHEIRO DE ANDRADE,180,SUPLENTE
22341,JOSELY ALVES CORREIA SIQUEIRA,130,ELEITO POR QP
20345,JOSELMA NONATO SOLIDADE LIMA,5,SUPLENTE
51051,JOSELMA MENDES GOMES,8,SUPLENTE
15456,JOSELMA CRISTINA DA SILVA,14,SUPLENTE
36123,JOSELLE CARNEIRO BARROS,1,NÃO ELEITO
14333,JOSELITO CARAMES DE MELO,512,ELEITO POR QP
55444,JOSELITO ALVES DIAS,248,SUPLENTE
10345,JOSELIO MOREIRA ROCHA,59,SUPLENTE
20777,JOSELIO DA SILVA MORAES,147,SUPLENTE
12700,JOSELIO ALVES DA SILVA,57,SUPLENTE
15100,JOSELINO HENRIQUE DE SOUSA,302,SUPLENTE
22333,JOSELINO DOS SANTOS LEAL,12,NÃO ELEITO
18190,JOSELIA DE SOUZA MATOS,12,SUPLENTE
14172,JOSELIA BRITO DE ALENCAR,4,NÃO ELEITO
13113,JOSELI PAULO MONTEIRO DA SILVA,16,NÃO ELEITO
50333,JOSELENA SANTOS COSTA DE SOUZA,11,NÃO ELEITO
20123,JOSELANDIA BARBOSA DE AQUINO,891,ELEITO POR QP
50123,JOSEILSON DE SOUZA XAVIER,352,ELEITO POR MÉDIA
15,JOSEILDA SILVA AMARAL,4024,NÃO ELEITO
15015,JOSEILDA BORGES TRINDADE,148,SUPLENTE
20111,JOSEFINA TEIXEIRA DA SILVA,40,SUPLENTE
19001,JOSEFA MARIA DE SOUSA,43,NÃO ELEITO
22456,JOSECLEI DE CASTRO,733,ELEITO POR QP
51000,JOSEANE GONÇALVES RABELO,38,NÃO ELEITO
22123,JOSEANE DE OLIVEIRA SEIXAS,635,ELEITO POR QP
11233,JOSEANE BERNARDO DA SILVA,10,NÃO ELEITO
40456,JOSE XAVIER DE OLIVEIRA,18,NÃO ELEITO
15555,JOSE WIRLEY FARIAS DA SILVA,179,SUPLENTE
25888,JOSE WILSON TEIXEIRA MOURÃO,66,SUPLENTE
10123,JOSE WILSON FAUSTINO DE ARAÚJO,396,SUPLENTE
50333,JOSE WILSON DE SOUZA,3,NÃO ELEITO
19190,JOSE WILSON COSTA MARTINS,38,SUPLENTE
28,JOSE WILLIAN SIQUEIRA DA FONSECA,13277,ELEITO
15,JOSE WILLIAN GONÇALVES DE OLIVEIRA,13267,NÃO ELEITO
23333,JOSE WESLEY LIMA FARIAS,37,NÃO ELEITO
25025,JOSE WELLINGTON DIOGO,24,SUPLENTE
15150,JOSE WALTER FEIO CUNHA,67,SUPLENTE
70222,JOSE VINAGRE DOS SANTOS FORO,115,SUPLENTE
15,JOSE VILLEIGAGNON RABELO OLIVEIRA,10625,ELEITO
43223,JOSE VIEIRA DE ALMEIDA,1402,ELEITO POR MÉDIA
20200,JOSE VICENTE DA CONCEIÇÃO MELO,1,SUPLENTE
11000,JOSE VALMIR RODRIGUES DOS SANTOS,335,SUPLENTE
12151,JOSE VALDO ARAUJO MOURA,6,SUPLENTE
25999,JOSE VALDENIZ DOS SANTOS TAKANO,73,SUPLENTE
15215,JOSE VALDEMIR PAULINO DE SANTANA,121,SUPLENTE
15100,JOSE VALDEMAR RODRIGUES SIQUEIRA DOS SANTOS,549,SUPLENTE
22444,JOSE VALCI URBANO PENA,153,SUPLENTE
25666,JOSE ULISSES NUNES DE OLIVEIRA,138,SUPLENTE
15150,JOSE TRINDADE SOARES SOZINHO,142,SUPLENTE
10123,JOSE TOLENTINO FERREIRA,84,SUPLENTE
70456,JOSE TEREZO DE SOUSA FERNANDES,398,SUPLENTE
27500,JOSE TADEU PEREIRA CUNHA,29,NÃO ELEITO
55333,JOSE SOUZA SANTOS,83,SUPLENTE
23000,JOSE SINEY SANTA BRIGIDA CARDOSO,13,NÃO ELEITO
45007,JOSE SILVERIO NUNES DA FONSECA,214,SUPLENTE
13133,JOSE SILVA FORO,10,NÃO ELEITO
20530,JOSE SEVERO LORA NETO,71,SUPLENTE
22123,JOSE SERGIO DOS SANTOS DUARTE,39,NÃO ELEITO
70450,JOSE SANTOS MONTEL,3,NÃO ELEITO
15177,JOSE SABINO CLEMENTINO DA SILVA,288,ELEITO POR MÉDIA
40400,JOSE RUBERVAL SILVA SILVEIRA,43,NÃO ELEITO
40001,JOSE RUBENS MONTEIRO LIMA,41,NÃO ELEITO
11123,JOSE ROZENILDO LOPES PEREIRA,541,ELEITO POR QP
40555,JOSE ROSIANO DE ALMEIDA ALVES,373,SUPLENTE
40500,JOSE ROOSEWELT CARMO DA SILVA,23,SUPLENTE
90500,JOSE RONY CAMPOS DE SOUZA,32,SUPLENTE
45143,JOSE RONALDO NETO DA SILVA,58,SUPLENTE
14617,JOSE RONALDO CARDOSO BRITO,510,ELEITO POR QP
77777,JOSE RONALDO ALVES DA MOTA FILHO,63,NÃO ELEITO
15777,JOSE RODRIGUES MARTINS FILHO,41,SUPLENTE
13456,JOSE RODRIGUES DE SOUZA,70,NÃO ELEITO
15600,JOSE RODRIGUES DE SOUSA,22,SUPLENTE
22,JOSE RODRIGUES DE MIRANDA,6934,NÃO ELEITO
55111,JOSE RODRIGUES DE CARVALHO JUNIOR,2,SUPLENTE
45155,JOSE RODRIGUES DA SILVA,46,SUPLENTE
90333,JOSE RODRIGUES DA CONCEIÇÃO,84,SUPLENTE
51100,JOSE RODRIGO LIMA DA SILVA,22,NÃO ELEITO
45007,JOSE RODRIGO CABRAL MELO,35,SUPLENTE
40000,JOSE ROCHA DE CARVALHO JUNIOR,336,SUPLENTE
20111,JOSE ROBIS DA SILVA,15,SUPLENTE
28111,JOSE ROBINALDO FURTADO SODRE,25,NÃO ELEITO
15000,JOSE ROBERTO SANTOS CORREA,987,ELEITO POR QP
36654,JOSE ROBERTO PANTOJA DE ALMEIDA,1,SUPLENTE
25625,JOSE ROBERTO OLIVEIRA DA COSTA,13,SUPLENTE
14999,JOSE ROBERTO OLIVEIRA AGUIAR,113,SUPLENTE
19123,JOSE ROBERTO LOPES DO NASCIMENTO,108,NÃO ELEITO
10377,JOSE ROBERTO LIMA LOPES,426,ELEITO POR MÉDIA
25444,JOSE ROBERTO FERREIRA SILVA,60,SUPLENTE
70789,JOSE ROBERTO FERREIRA,636,ELEITO POR MÉDIA
19123,JOSE ROBERTO DO NASCIMENTO LEAL,307,SUPLENTE
22999,JOSE ROBERTO DE FRANÇA ALVES,5,NÃO ELEITO
45234,JOSE ROBERTO DA SILVA RIBEIRO,243,SUPLENTE
23523,JOSE ROBERTO DA SILVA COSTA,53,NÃO ELEITO
90110,JOSE ROBERTO DA SILVA BATISTA,145,SUPLENTE
55612,JOSE RIVANALDO ARAUJO,919,ELEITO POR QP
22222,JOSE RICARDO SOUZA RIOS,500,ELEITO POR MÉDIA
90094,JOSE RICARDO SILVA NASCIMENTO,13,SUPLENTE
13333,JOSE RICARDO LIMA MACHADO,39,SUPLENTE
10222,JOSE RICARDO GOMES DA SILVA,288,SUPLENTE
19333,JOSE RICARDO GALVÃO ARAUJO,24,NÃO ELEITO
23253,JOSE RICARDO ANDRADE DA SILVA,3,SUPLENTE
70222,JOSE RIBEIRO DE SOUSA,8,NÃO ELEITO
14,JOSE RIBAMAR SOUSA DA SILVA,2969,ELEITO
70123,JOSE RIBAMAR SILVA,189,SUPLENTE
55678,JOSE RIBAMAR RODRIGUES SILVA,18,SUPLENTE
15333,JOSE RIBAMAR RODRIGUES DE SOUSA,228,SUPLENTE
19056,JOSE RIBAMAR QUEIROZ ALVES,44,SUPLENTE
45222,JOSE RIBAMAR PEREIRA DE OLIVEIRA,81,SUPLENTE
15,JOSE RIBAMAR FERREIRA LIMA,5179,NÃO ELEITO
15888,JOSE RIBAMAR DA SILVA RIBEIRO,168,SUPLENTE
14555,JOSE RIBAMAR CASTRO DA SILVA,163,SUPLENTE
77321,JOSE RIBAMAR ALMEIDA BASTOS,35,SUPLENTE
23777,JOSE RENATO PORTILHO GOMES,257,NÃO ELEITO
17444,JOSE RENATO FUMEIRO DA COSTA,72,SUPLENTE
45456,JOSE REINAN SALES DE ARAUJO,359,ELEITO POR QP
22100,JOSE REINALDO FERREIRA,673,SUPLENTE
10111,JOSE REINALDO DOS SANTOS,96,SUPLENTE
15456,JOSE REGINALDO MARQUES DO NASCIMENTO,165,SUPLENTE
90122,JOSE RAMOS DA COSTA JUNIOR,92,NÃO ELEITO
51123,JOSE RAIMUNDO TRINDADE PEREIRA,21,NÃO ELEITO
28888,JOSE RAIMUNDO RODRIGUES MARTINS,120,NÃO ELEITO
55777,JOSE RAIMUNDO MIRANDA GUIMARÃES,156,SUPLENTE
45645,JOSE RAIMUNDO MELO DOS SANTOS,125,SUPLENTE
77007,JOSE RAIMUNDO LINHARES DA SILVA,10,SUPLENTE
90445,JOSE RAIMUNDO GONCALVES ESTUMANO,335,NÃO ELEITO
70232,JOSE RAIMUNDO GIOCA MENDES,2,SUPLENTE
10140,JOSE RAIMUNDO FERREIRA DOS SANTOS,15,NÃO ELEITO
19888,JOSE RAIMUNDO DA ROCHA,42,SUPLENTE
45888,JOSE RAIMUNDO DA CONCEIÇÃO ALVES,38,SUPLENTE
13645,JOSE RAIMUNDO DA CONCEIÇAO RAMOS,39,SUPLENTE
40223,JOSE RAIMUNDO BASTOS DA SILVA,223,SUPLENTE
55555,JOSE RAIMUNDO ANDRADE DE LIMA,170,SUPLENTE
10333,JOSE RAIMUNDO ALVES DA COSTA,47,SUPLENTE
10123,JOSE RAIMUNDO ALBUQUERQUE GADELHA,619,SUPLENTE
11234,JOSE RAFAEL VALENTE NETO,476,SUPLENTE
77000,JOSE PETRONIO BRAZ DOS SANTOS,45,NÃO ELEITO
45555,JOSE PEREIRA RAMALHO,259,SUPLENTE
13222,JOSE PEREIRA DE OLIVEIRA,87,SUPLENTE
15000,JOSE PEREIRA DA SILVA,71,SUPLENTE
90456,JOSE PAULO SANTOS SILVA,127,SUPLENTE
45000,JOSE PAES LANDIM,6,SUPLENTE
19000,JOSE PACIFICO NETO,148,SUPLENTE
18678,JOSE OTAVIANO FIGUEIRA CAMPOS,394,ELEITO POR MÉDIA
77677,JOSE OSEAS VIEIRA DA SILVA,122,NÃO ELEITO
90333,JOSE ORLANDO VARELA DOS SANTOS,77,NÃO ELEITO
15555,JOSE ORLANDO PAULINO DE SOUSA,1386,ELEITO POR QP
40777,JOSE ORLANDO FERREIRA GOMES,116,NÃO ELEITO
40147,JOSE ORLANDO FARIAS LIMA,61,NÃO ELEITO
45123,JOSE ORLANDO DA SILVA,112,SUPLENTE
15444,JOSE ORIONES DOS SANTOS,128,SUPLENTE
90999,JOSE OLIVEIRA SOUZA,334,ELEITO POR QP
43661,JOSE OLIVEIRA AMORIM,12,SUPLENTE
65200,JOSE ODIR MACEDO SANTOS,111,SUPLENTE
45000,JOSE ODEJAN FONSECA DA SILVA,239,SUPLENTE
22222,JOSE ODAIR SILVA SOARES,160,SUPLENTE
20300,JOSE ODAIR PEREIRA MATOS,148,SUPLENTE
19777,JOSE ODACIR DOS SANTOS,11,SUPLENTE
65765,JOSE OBERTO PINHEIRO MONTEIRO,3,SUPLENTE
40444,JOSE NONATO RODRIGUES FERNANDES,35,SUPLENTE
25444,JOSE NIVALDO DO NASCIMENTO,157,SUPLENTE
10110,JOSE NILVAM ALVES,53,NÃO ELEITO
13555,JOSE NILTON SERRAO FARIAS,261,SUPLENTE
20000,JOSE NILTON COELHO RODRIGUES,149,SUPLENTE
